[
  {
    "url": "https://sei.ibama.gov.br/documento_consulta_externa.php?id_acesso_externo=1261069&id_documento=18738645&infra_hash=d571f20ea0bdd0bc03680c7c433592e5",
    "data": {
      "metadata": {
        "Código:": "1 – 1",
        "Versão FTE:": "1.4"
      },
      "sections": [
        {
          "title": "PP/GU:",
          "content": "Alto",
          "items": []
        },
        {
          "title": "Descritor",
          "content": "0990-4/01",
          "items": []
        },
        {
          "title": "Descritor",
          "content": "7119-7/02",
          "items": []
        },
        {
          "title": "Descritor",
          "content": "7119-7/02",
          "items": []
        },
        {
          "title": "Descritor",
          "content": "7119-7/02",
          "items": []
        },
        {
          "title": "Descritor",
          "content": "7119-7/02",
          "items": []
        },
        {
          "title": "Descritor",
          "content": "7119-7/02",
          "items": []
        },
        {
          "title": "Descritor",
          "content": "7119-7/02",
          "items": []
        },
        {
          "title": "Descritor",
          "content": "7119-7/02",
          "items": []
        },
        {
          "title": "Descritor",
          "content": "7119-7/02",
          "items": []
        },
        {
          "title": "Descritor",
          "content": "7119-7/02",
          "items": []
        },
        {
          "title": "Descritor",
          "content": "7119-7/02",
          "items": []
        },
        {
          "title": "Descritor",
          "content": "7119-7/02",
          "items": []
        },
        {
          "title": "Descritor",
          "content": "7119-7/02",
          "items": []
        },
        {
          "title": "Descritor",
          "content": "7119-7/02",
          "items": []
        },
        {
          "title": "Subclasse",
          "content": "0990-4/02",
          "items": []
        },
        {
          "title": "Subclasse",
          "content": "0990-4/03",
          "items": []
        },
        {
          "title": "CTF/APP:",
          "content": "consulte a relação deFichas Técnicas de Enquadramento.",
          "items": []
        },
        {
          "title": "CNORP:",
          "content": "sim.",
          "items": []
        },
        {
          "title": "CTF/AIDA:",
          "content": "sim.",
          "items": []
        },
        {
          "title": "RAPP:",
          "content": "sim.",
          "items": []
        },
        {
          "title": "1",
          "content": "Lei Complementar nº 140, de 8 de dezembro de 2011:art. 7º, XIV, “g”: referente ao licenciamento ambiental de pesquisa minerária envolvendo material radioativo, mediante parecer da Comissão Nacional de Energia Nuclear – CNEN;",
          "items": []
        },
        {
          "title": "2",
          "content": "Decreto-Lei nº 227, de 28 de fevereiro de 1967(e alterações): referente ao Código de Minas;",
          "items": []
        },
        {
          "title": "3",
          "content": "Lei nº6.567, de 24 de setembro de 1978: referente ao regime de exploração e aproveitamento de areias, cascalhos, saibros e argilas, em área máxima de cinquenta hectares;",
          "items": []
        },
        {
          "title": "4",
          "content": "Lei nº 6.938, de 31 de agosto de 1981(e alterações): art. 9º, XII; art. 17, II; Anexo VIII;",
          "items": []
        },
        {
          "title": "5",
          "content": "Lei nº 12.305, de 2 de agosto de 2010: referente à Política Nacional de Resíduos Sólidos e ao Cadastro Nacional de Operadores de Resíduos Perigosos – CNORP;",
          "items": []
        },
        {
          "title": "6",
          "content": "Decreto nº 97.632, de 10 de abril de 1989: referente à exigência de plano de recuperação de área degradada para os empreendimentos de exploração de recursos minerais;",
          "items": []
        },
        {
          "title": "7",
          "content": "Decreto nº 9.406, de 12 de junho de 2018: referente à regulamentação do Código de Minas;",
          "items": []
        },
        {
          "title": "8",
          "content": "Resolução CONAMA nº 1, de 23 de janeiro de 1986: art. 2º, IX: referente ao impacto ambiental da extração de minério, sujeita à Estudo de Impacto Ambiental e Relatório de Impacto Ambiental – EIA/RIMA;",
          "items": []
        },
        {
          "title": "9",
          "content": "Resolução CONAMA nº 237, de 19 de dezembro de 1997: referente à prevenção e ao controle de poluição da atividade Pesquisa mineral com guia de utilização, por meio de licenciamento ambiental;",
          "items": []
        },
        {
          "title": "10",
          "content": "Instrução Normativa Ibama nº 13, de 18 de dezembro de 2012: referente à Lista Brasileira de Resíduos Sólidos;",
          "items": []
        },
        {
          "title": "11",
          "content": "Instrução Normativa Ibama nº 1, de 25 de janeiro de 2013:referente ao Cadastro Nacional de Operadores de Resíduos Perigosos – CNORP;",
          "items": []
        },
        {
          "title": "12",
          "content": "Instrução Normativa Ibama nº 12, de 20 de agosto de 2021: referente ao Cadastro Técnico Federal de Atividades e Instrumentos de Defesa Ambiental – CTF/AIDA;",
          "items": []
        },
        {
          "title": "13",
          "content": "Instrução Normativa Ibama nº 13, de 23 de agosto de 2021: referente ao Cadastro Técnico Federal de Atividades Potencialmente Poluidoras e Utilizadoras de Recursos Ambientais – CTF/APP;",
          "items": []
        },
        {
          "title": "14",
          "content": "Instrução Normativa Ibama nº 22, de 22 de dezembro de 2021: referente ao Relatório Anual de Atividades Potencialmente Poluidoras e Utilizadoras de Recursos Ambientais – RAPP;",
          "items": []
        },
        {
          "title": "15",
          "content": "ABNT NBR 12235:1992: Armazenamento de resíduos sólidos perigosos – Procedimento;",
          "items": []
        },
        {
          "title": "16",
          "content": "Portaria DNPM nº 155, de 12 de maio de 2016: referente à Consolidação Normativa do DNPM.",
          "items": []
        }
      ],
      "raw_content": "SEI/IBAMA - 17021350 - Ficha Técnica de Enquadramento\nMinistério do Meio Ambiente\nInstituto Brasileiro do Meio Ambiente e dos Recursos Naturais Renováveis\nCadastro Técnico Federal de Atividades Potencialmente Poluidoras e Utilizadoras de Recursos Ambientais – CTF/APP\nFICHA TÉCNICA DE ENQUADRAMENTO\nCódigo:\n1 – 1\nDescrição:\nPesquisa mineral com guia de utilização\nVersão FTE:\n1.4\nData:\n29/01/2024\nPP/GU:\nAlto\nTipo de pessoa:\nPessoa jurídica:\nSim\n(1)\nPessoa física:\nSim\n(1)\nA descrição compreende:\n- a aferição da viabilidade técnico-econômica da lavra de substâncias minerais no mercado nacional e/ou internacional, a partir de Guia de Utilização emitida pela Agência Nacional de Mineração – ANM;\n- a extração de substâncias minerais para análise e ensaios industriais antes da outorga da concessão de lavra, por meio de Guia de Utilização emitida pelo ANM;\n- a comercialização de substâncias minerais de acordo com as políticas públicas, antes da outorga de concessão de lavra, a partir de Guia de Utilização emitida pelo ANM;\n- o depósito de resíduos perigosos, no mesmo estabelecimento em que ocorra a sua geração, e que serão expedidos para tratamento, destinação ou disposição;\n- o depósito para estocagem, no mesmo estabelecimento industrial em que ocorra a sua utilização, de produto perigoso que seja matéria-prima, insumo ou fonte de energia de processo industrial;\n- o tratamento de efluentes industriais no próprio estabelecimento industrial gerador de efluentes.\nÉ obrigada à inscrição no\nCadastro Técnico Federal de Atividades Potencialmente Poluidoras e Utilizadoras de Recursos Ambientais\n,\ndeclarando a atividade cód.\n1 – 1, a pessoa física ou jurídica que exerça atividade, em caráter permanente ou eventual, ou constitua empreendimento, conforme descrições no campo acima.\nA descrição não\ncompreende:\n(Para descrições com código em parênteses, consulte as respectivas FTE.)\n- a exploração e avaliação de jazidas de petróleo e gás natural (1 – 5);\n- a disposição final de rejeitos da indústria ou da mineração em confinamento licenciado pelo órgão ambiental competente (17 – 58);\n- o tratamento de resíduos de mineração (17 – 59);\n- a recuperação de áreas degradadas (17 – 67);\n- a recuperação de áreas contaminadas (17 – 68);\n- atividade de extração mineral em regime de autorização de pesquisa, sem guia de utilização.\nNão é obrigada à inscrição no\nCadastro Técnico Federal de Atividades Potencialmente Poluidoras e Utilizadoras de Recursos Ambientais\n,\nem razão da atividade cód.\n1 – 1, a pessoa física ou jurídica que exerça atividade ou constitua empreendimento, conforme descrições no campo acima.\nDefinições e linhas de corte:\n-\nGuia de Utilização:\ndocumento emitido pela Agência Nacional de Mineração que autoriza, em caráter excepcional, a extração de substâncias minerais em área titulada, antes da outorga da concessão de lavra;\n-\nlavra:\nconjunto de operações coordenadas realizadas de forma racional, econômica e sustentável objetivando o aproveitamento da jazida até o beneficiamento associado ou em continuação à extração, realizado dentro da área de lavra, das substâncias minerais nela encontradas, inclusive, maximizando-se o seu valor ao final de sua vida útil;\n-\nmineral:\nsubstância sólida, de ocorrência natural, homogênea e com composição química e estrutura cristalina constantes e definidas;\n-\npesquisa mineral:\nlevantamentos geológicos pormenorizados da área a pesquisar, em escala conveniente, os estudos dos afloramentos e suas correlações, os levantamentos geofísicos e geoquímicos; as aberturas de escavações visitáveis e execução de sondagens no corpo mineral, as amostragens sistemáticas, as análises físicas e químicas das amostras e dos testemunhos de sondagens e ensaios de beneficiamento dos minérios ou das substâncias minerais úteis, para obtenção de concentrados de acordo com as especificações do mercado ou aproveitamento industrial, dentre outros;\n- regime de autorização\n: destinado às atividades de pesquisa mineral, outorgada por ato da Agência Nacional de Mineração;\n- regime de concessão\n: destinado às atividades de lavra mineral precedidas de pesquisa, outorgada por ato do Ministro de Estado de Minas e Energia, ou da Agência Nacional de Mineração, na hipótese de a concessão ter por objeto as substâncias minerais de que trata o art. 1º da Lei nº 6.567, de 1978;\n- regime de lavra garimpeira\n: destinado à atividade de lavra mineral prevista na Lei nº 7.805, de 1989, outorgada por título expedido pela Agência Nacional de Mineração;\n- regime de licenciamento\n: destinado às atividades de lavra das substâncias minerais de que trata o art. 1º da Lei nº 6.567, de 1978, outorgado por licença expedida em conformidade com regulamentos administrativos locais e por registro da licença na Agência Nacional de Mineração;\n- regime de monopolização\n: quando, em decorrência de lei especial, o aproveitamento de recursos minerais depender de execução direta ou indireta do Poder Executivo federal.\nClassificação Nacional de Atividades Econômicas\n–\nCNAE:\nAgrupamento:\nCódigo:\nDescrição:\nDescritor\n0990-4/01\nPERFURAÇÃO, PROSPECÇÃO, RETIRADA DE AMOSTRAS PARA EXTRAÇÃO DE MINÉRIO DE FERRO REALIZADAS SOB CONTRATO, SERVIÇOS DE\nDescritor\n7119-7/02\nANALISES DE SOLO PARA INVESTIGAÇÃO GEOLÓGICA; SERVIÇOS DE\nDescritor\n7119-7/02\nESTUDOS GEOTÉCNICOS\nDescritor\n7119-7/02\nESTUDOS SISMOGRÁFICOS\nDescritor\n7119-7/02\nLEVANTAMENTOS GEOLÓGICOS; SERVIÇOS DE\nDescritor\n7119-7/02\nLEVANTAMENTOS, ESTUDOS GEOFÍSICOS; SERVIÇOS DE\nDescritor\n7119-7/02\nLEVANTAMENTOS, ESTUDOS HIDROGRÁFICOS; SERVIÇOS DE\nDescritor\n7119-7/02\nPERFILAGEM DE SOLO; SERVIÇOS DE\nDescritor\n7119-7/02\nPROSPECÇÃO GEOLÓGICA; SERVIÇOS DE\nDescritor\n7119-7/02\nPROSPECÇÃO SÍSMICA\nDescritor\n7119-7/02\nPROSPECÇÃO, PESQUISA MINERAL; SERVIÇOS DE\nDescritor\n7119-7/02\nSERVIÇOS TÉCNICOS EM GEOLOGIA\nDescritor\n7119-7/02\nSISMOGRAFIA; ATIVIDADES DE\nDescritor\n7119-7/02\nESTUDOS GEOLÓGICOS BASEADOS EM MEDIÇÕES E OBSERVAÇÕES DE SUPERFÍCIE PARA A OBTENÇÃO DE INFORMAÇÕES SOBRE A ESTRUTURA DO SUBSOLO, LOCALIZAÇÃO DE MINERAIS; ATIVIDADES DE\nSubclasse\n0990-4/02\nAtividades de apoio à extração de minerais metálicos não ferrosos\nSubclasse\n0990-4/03\nAtividades de apoio à extração de minerais não metálicos\nA obrigação de inscrição, no Cadastro Técnico Federal de Atividades Potencialmente Poluidoras e Utilizadoras de Recursos Ambientais, não se vincula à Classificação Nacional de Atividades Econômicas, que pode ser utilizada como referência de enquadramento.\nOutras atividades do Cadastro Técnico Federal de Atividades Potencialmente Poluidoras e Utilizadoras de Recursos Ambientais, Cadastros do Ibama e Relatório Anual de Atividades:\nCTF/APP:\nconsulte a relação de\nFichas Técnicas de Enquadramento.\nCNORP:\nsim.\nCTF/AIDA:\nsim.\nRAPP:\nsim.\nA declaração de atividades, no Cadastro Técnico Federal de Atividades Potencialmente Poluidoras e Utilizadoras de Recursos Ambientais, que sejam constantes do objeto social da empresa ou da inscrição no Cadastro Nacional da Pessoa Jurídica (CNPJ) não desobriga a pessoa jurídica de declarar outras atividades potencialmente poluidoras e utilizadoras de recursos ambientais que sejam exercidas pela empresa.\nObservações:\n(\n1\n)\né obrigada à inscrição, nono Cadastro Técnico Federal de Atividades Potencialmente Poluidoras e Utilizadoras de Recursos Ambientais, a pessoa titular do alvará da pesquisa minerária, seja pessoa física, seja pessoa jurídica, inclusive as cooperativas minerárias.\nReferências normativas:\n1\nLei Complementar nº 140, de 8 de dezembro de 20\n1\n1\n:\nart. 7º, XIV, “g”: referente ao licenciamento ambiental de pesquisa minerária envolvendo material radioativo, mediante parecer da Comissão Nacional de Energia Nuclear – CNEN;\n2\nDecreto-Lei nº 227, de 28 de fevereiro de 1967\n(e alterações): referente ao Código de Minas;\n3\nLei nº\n6.567, de 24 de setembro de 1978\n: referente ao regime de exploração e aproveitamento de areias, cascalhos, saibros e argilas, em área máxima de cinquenta hectares;\n4\nLei nº 6.938, de 31 de agosto de 1981\n(e alterações): art. 9º, XII; art. 17, II; Anexo VIII;\n5\nLei nº 12.305, de 2 de agosto de 2010\n: referente à Política Nacional de Resíduos Sólidos e ao Cadastro Nacional de Operadores de Resíduos Perigosos – CNORP;\n6\nDecreto nº 97.632, de 10 de abril de 1989\n: referente à exigência de plano de recuperação de área degradada para os empreendimentos de exploração de recursos minerais;\n7\nDecreto nº 9.406, de 12 de junho de 2018\n: referente à regulamentação do Código de Minas;\n8\nResolução CONAMA nº 1, de 23 de janeiro de 1986: art. 2º, IX: referente ao impacto ambiental da extração de minério, sujeita à Estudo de Impacto Ambiental e Relatório de Impacto Ambiental – EIA/RIMA;\n9\nResolução CONAMA nº 237, de 19 de dezembro de 1997: referente à prevenção e ao controle de poluição da atividade Pesquisa mineral com guia de utilização, por meio de licenciamento ambiental;\n10\nInstrução Normativa Ibama nº 13, de 18 de dezembro de 2012\n: referente à Lista Brasileira de Resíduos Sólidos;\n11\nInstrução Normativa Ibama nº 1, de 25 de janeiro de 2013\n:\nreferente ao Cadastro Nacional de Operadores de Resíduos Perigosos – CNORP;\n12\nInstrução Normativa Ibama nº 12, de 20 de agosto de 2021\n: referente ao Cadastro Técnico Federal de Atividades e Instrumentos de Defesa Ambiental – CTF/AIDA;\n13\nInstrução Normativa Ibama nº 13, de 23 de agosto de 2021\n: referente ao Cadastro Técnico Federal de Atividades Potencialmente Poluidoras e Utilizadoras de Recursos Ambientais – CTF/APP;\n14\nInstrução Normativa Ibama nº 22, de 22 de dezembro de 2021\n: referente ao Relatório Anual de Atividades Potencialmente Poluidoras e Utilizadoras de Recursos Ambientais – RAPP;\n15\nABNT NBR 12235:1992\n: Armazenamento de resíduos sólidos perigosos – Procedimento;\n16\nPortaria DNPM nº 155, de 12 de maio de 2016\n: referente à Consolidação Normativa do DNPM.\nDocumento assinado eletronicamente por\nRODRIGO ANTONIO DE AGOSTINHO MENDONÇA\n,\nPresidente\n, em 06/02/2024, às 18:09, conforme horário oficial de Brasília, com fundamento no art. 6º, § 1º, do\nDecreto nº 8.539, de 8 de outubro de 2015\n.\nA autenticidade deste documento pode ser conferida no site\nhttps://sei.ibama.gov.br/autenticidade\n, informando o código verificador\n17021350\ne o código CRC\nFE09B954\n.\nReferência:\nProcesso nº 02001.001882/2018-83\nSEI nº 17021350",
      "Classificação Nacional de Atividades Econômicas": [
        {
          "agrupamento": "descritor",
          "código": "0990-4/01",
          "descricao": "PERFURAÇÃO, PROSPECÇÃO, RETIRADA DE AMOSTRAS PARA EXTRAÇÃO DE MINÉRIO DE FERRO REALIZADAS SOB CONTRATO, SERVIÇOS DE"
        },
        {
          "agrupamento": "descritor",
          "código": "7119-7/02",
          "descricao": "ANALISES DE SOLO PARA INVESTIGAÇÃO GEOLÓGICA; SERVIÇOS DE"
        },
        {
          "agrupamento": "descritor",
          "código": "7119-7/02",
          "descricao": "ANALISES DE SOLO PARA INVESTIGAÇÃO GEOLÓGICA; SERVIÇOS DE"
        },
        {
          "agrupamento": "descritor",
          "código": "7119-7/02",
          "descricao": "ANALISES DE SOLO PARA INVESTIGAÇÃO GEOLÓGICA; SERVIÇOS DE"
        },
        {
          "agrupamento": "descritor",
          "código": "7119-7/02",
          "descricao": "ANALISES DE SOLO PARA INVESTIGAÇÃO GEOLÓGICA; SERVIÇOS DE"
        },
        {
          "agrupamento": "descritor",
          "código": "7119-7/02",
          "descricao": "ANALISES DE SOLO PARA INVESTIGAÇÃO GEOLÓGICA; SERVIÇOS DE"
        },
        {
          "agrupamento": "descritor",
          "código": "7119-7/02",
          "descricao": "ANALISES DE SOLO PARA INVESTIGAÇÃO GEOLÓGICA; SERVIÇOS DE"
        },
        {
          "agrupamento": "descritor",
          "código": "7119-7/02",
          "descricao": "ANALISES DE SOLO PARA INVESTIGAÇÃO GEOLÓGICA; SERVIÇOS DE"
        },
        {
          "agrupamento": "descritor",
          "código": "7119-7/02",
          "descricao": "ANALISES DE SOLO PARA INVESTIGAÇÃO GEOLÓGICA; SERVIÇOS DE"
        },
        {
          "agrupamento": "descritor",
          "código": "7119-7/02",
          "descricao": "ANALISES DE SOLO PARA INVESTIGAÇÃO GEOLÓGICA; SERVIÇOS DE"
        },
        {
          "agrupamento": "descritor",
          "código": "7119-7/02",
          "descricao": "ANALISES DE SOLO PARA INVESTIGAÇÃO GEOLÓGICA; SERVIÇOS DE"
        },
        {
          "agrupamento": "descritor",
          "código": "7119-7/02",
          "descricao": "ANALISES DE SOLO PARA INVESTIGAÇÃO GEOLÓGICA; SERVIÇOS DE"
        },
        {
          "agrupamento": "descritor",
          "código": "7119-7/02",
          "descricao": "ANALISES DE SOLO PARA INVESTIGAÇÃO GEOLÓGICA; SERVIÇOS DE"
        },
        {
          "agrupamento": "descritor",
          "código": "7119-7/02",
          "descricao": "ANALISES DE SOLO PARA INVESTIGAÇÃO GEOLÓGICA; SERVIÇOS DE"
        },
        {
          "agrupamento": "subclasse",
          "código": "0990-4/02",
          "descricao": "Atividades de apoio à extração de minerais metálicos não ferrosos"
        },
        {
          "agrupamento": "subclasse",
          "código": "0990-4/03",
          "descricao": "Atividades de apoio à extração de minerais não metálicos"
        }
      ]
    }
  },
  {
    "url": "https://sei.ibama.gov.br/documento_consulta_externa.php?id_acesso_externo=1261093&id_documento=18550666&infra_hash=74d48482f43654c143367dc78e20a0fa",
    "data": {
      "metadata": {
        "Código:": "1 – 2",
        "Versão FTE:": "1.4"
      },
      "sections": [
        {
          "title": "PP/GU:",
          "content": "Alto",
          "items": []
        },
        {
          "title": "Descritor",
          "content": "0892-4/03",
          "items": []
        },
        {
          "title": "Descritor",
          "content": "0892-4/03",
          "items": []
        },
        {
          "title": "Descritor",
          "content": "0892-4/03",
          "items": []
        },
        {
          "title": "Descritor",
          "content": "0892-4/03",
          "items": []
        },
        {
          "title": "Descritor",
          "content": "0892-4/03",
          "items": []
        },
        {
          "title": "Subclasse",
          "content": "0500-3/01",
          "items": []
        },
        {
          "title": "Subclasse",
          "content": "0710-3/01",
          "items": []
        },
        {
          "title": "Subclasse",
          "content": "0721-9/01",
          "items": []
        },
        {
          "title": "Subclasse",
          "content": "0722-7/01",
          "items": []
        },
        {
          "title": "Subclasse",
          "content": "0723-5/01",
          "items": []
        },
        {
          "title": "Subclasse",
          "content": "0724-3/01",
          "items": []
        },
        {
          "title": "Subclasse",
          "content": "0725-1/00",
          "items": []
        },
        {
          "title": "Subclasse",
          "content": "0729-4/01",
          "items": []
        },
        {
          "title": "Subclasse",
          "content": "0729-4/02",
          "items": []
        },
        {
          "title": "Subclasse",
          "content": "0729-4/03",
          "items": []
        },
        {
          "title": "Subclasse",
          "content": "0729-4/04",
          "items": []
        },
        {
          "title": "Subclasse",
          "content": "0729-4/05",
          "items": []
        },
        {
          "title": "Subclasse",
          "content": "0810-0/01",
          "items": []
        },
        {
          "title": "Subclasse",
          "content": "0810-0/02",
          "items": []
        },
        {
          "title": "Subclasse",
          "content": "0810-0/03",
          "items": []
        },
        {
          "title": "Subclasse",
          "content": "0810-0/04",
          "items": []
        },
        {
          "title": "Subclasse",
          "content": "0810-0/05",
          "items": []
        },
        {
          "title": "Subclasse",
          "content": "0810-0/06",
          "items": []
        },
        {
          "title": "Subclasse",
          "content": "0810-0/07",
          "items": []
        },
        {
          "title": "Subclasse",
          "content": "0810-0/08",
          "items": []
        },
        {
          "title": "Subclasse",
          "content": "0810-0/09",
          "items": []
        },
        {
          "title": "Subclasse",
          "content": "0810-0/10",
          "items": []
        },
        {
          "title": "Subclasse",
          "content": "0810-0/99",
          "items": []
        },
        {
          "title": "Subclasse",
          "content": "0891-6/00",
          "items": []
        },
        {
          "title": "Subclasse",
          "content": "0892-4/02",
          "items": []
        },
        {
          "title": "Subclasse",
          "content": "0893-2/00",
          "items": []
        },
        {
          "title": "Subclasse",
          "content": "0899-1/01",
          "items": []
        },
        {
          "title": "Subclasse",
          "content": "0899-1/02",
          "items": []
        },
        {
          "title": "Subclasse",
          "content": "0899-1/99",
          "items": []
        },
        {
          "title": "Subclasse",
          "content": "0990-4/02",
          "items": []
        },
        {
          "title": "Subclasse",
          "content": "0990-4/03",
          "items": []
        },
        {
          "title": "CTF/APP:",
          "content": "consulte a relação deFichas Técnicas de Enquadramento.",
          "items": []
        },
        {
          "title": "CNORP:",
          "content": "sim.",
          "items": []
        },
        {
          "title": "CTF/AIDA:",
          "content": "sim.",
          "items": []
        },
        {
          "title": "RAPP:",
          "content": "sim.",
          "items": []
        },
        {
          "title": "1",
          "content": "Lei Complementar nº 140, de 8 de dezembro de 2011: art. 7º, XIV, “g”: referente ao licenciamento ambiental de lavra envolvendo material radioativo, mediante parecer da Comissão Nacional de Energia Nuclear – CNEN;",
          "items": []
        },
        {
          "title": "2",
          "content": "Lei nº 4.118, de 27 de agosto de 1962(e alterações): referente à Política Nacional de Energia Nuclear;",
          "items": []
        },
        {
          "title": "3",
          "content": "Decreto-Lei nº 227, de 28 de fevereiro de 1967(e alterações): referente ao Código de Minas;",
          "items": []
        },
        {
          "title": "4",
          "content": "Lei nº 6.189, de 16 de dezembro de 1974(e alterações): referente ao escopo do licenciamento nuclear, sob competência da Comissão Nacional de Energia Nuclear – CNEN;",
          "items": []
        },
        {
          "title": "5",
          "content": "Lei nº6.567, de 24 de setembro de 1978: referente ao regime de exploração e aproveitamento de areias, cascalhos, saibros e argilas, em área máxima de cinquenta hectares;",
          "items": []
        },
        {
          "title": "6",
          "content": "Lei nº 6.938, de 31 de agosto de 1981(e alterações): art. 9º, XII; art. 17, II; Anexo VIII;",
          "items": []
        },
        {
          "title": "7",
          "content": "Lei nº 12.305, de 2 de agosto de 2010: referente à Política Nacional de Resíduos Sólidos e ao Cadastro Nacional de Operadores de Resíduos Perigosos – CNORP;",
          "items": []
        },
        {
          "title": "8",
          "content": "Decreto nº 97.632, de 10 de abril de 1989: referente à exigência de plano de recuperação de área degradada para os empreendimentos de exploração de recursos minerais;",
          "items": []
        },
        {
          "title": "9",
          "content": "Resolução CONAMA nº 1, de 23 de janeiro de 1986:art. 2º, IX: referente ao impacto ambiental da extração de minério, sujeita à Estudo de Impacto Ambiental e Relatório de Impacto Ambiental – EIA/RIMA;",
          "items": []
        },
        {
          "title": "10",
          "content": "Resolução CONAMA nº 5, de 15 de junho de 1989 (e complementações):referente ao Programa Nacional de Controle da Qualidade do Ar - PRONAR, um dos instrumentos básicos da gestão ambiental para proteção da saúde e bem-estar das populações e melhoria da qualidade de vida com o objetivo de permitir o desenvolvimento econômico e social do País de forma ambientalmente segura, pela limitação dos níveis de emissão de poluentes por fontes de poluição atmosférica;",
          "items": []
        },
        {
          "title": "11",
          "content": "Resolução CONAMA nº 237, de 19 de dezembro de 1997:referente à prevenção e ao controle de poluição da atividade Lavra a céu aberto, inclusive de aluvião, com ou sem beneficiamento, por meio de licenciamento ambiental;",
          "items": []
        },
        {
          "title": "12",
          "content": "Resolução CONAMA nº 369, de 28 de março de 2006:referente à intervenção ou supressão de vegetação em Área de Preservação Permanente – APP em caráter excepcional de utilidade pública;",
          "items": []
        },
        {
          "title": "13",
          "content": "Resolução CONAMA nº 382, de 26 de dezembro de 2006 (e complementações):referente ao controle ambiental da emissão de poluentes atmosféricos para fontes fixas;",
          "items": []
        },
        {
          "title": "14",
          "content": "Resolução CONAMA nº 428, de 17 de dezembro de 2010 (e alterações):referente à autorização de licenciamento ambiental pelos órgãos responsáveis por Unidades de Conservação;",
          "items": []
        },
        {
          "title": "15",
          "content": "Resolução CONAMA nº 436, de 22 de dezembro de 2011: ANEXO XIII:referente aos limites de emissão para poluentes atmosféricos gerados nas usinas de pelotização de minério de ferro instaladas ou com pedido de licença de instalação anteriores a 2 de janeiro de 2007;",
          "items": []
        },
        {
          "title": "16",
          "content": "Portaria MMAnº 55, de 17 de fevereiro de 2014:referente aos procedimentos entre o Instituto Chico Mendes de Conservação da Biodiversidade - Instituto Chico Mendes e o Instituto Brasileiro do Meio Ambiente e dos Recursos Naturais Renováveis - IBAMA relacionados à Resolução nº 428, de 17 de dezembro de 2010, do Conselho Nacional do Meio Ambiente – CONAMA, no âmbito do licenciamento ambiental federal;",
          "items": []
        },
        {
          "title": "17",
          "content": "Instrução Normativa Ibama nº 184, de 17 de julho de 2008 (e alterações): referente aos procedimentos para o licenciamento ambiental federal;",
          "items": []
        },
        {
          "title": "18",
          "content": "Instrução Normativa Ibama nº 184, de 17 de julho de 2008 (e alterações): art. 35-A: referente à obrigação de atualização, no que couber, de atividades potencialmente poluidoras e utilizadoras de recursos ambientais no CTF/APP, quando da emissão da Licença de Operação – LO;",
          "items": []
        },
        {
          "title": "19",
          "content": "Instrução Normativa Ibama nº 13, de 18 de dezembro de 2012: referente à Lista Brasileira de Resíduos Sólidos;",
          "items": []
        },
        {
          "title": "20",
          "content": "Instrução Normativa Ibama nº 1, de 25 de janeiro de 2013:referente ao Cadastro Nacional de Operadores de Resíduos Perigosos – CNORP;",
          "items": []
        },
        {
          "title": "21",
          "content": "Instrução Normativa Ibama nº 15, de 6 de outubro de 2014: referente ao Sistema Nacional de Emergências Ambientais – SIEMA e às comunicações de acidentes ambientais;",
          "items": []
        },
        {
          "title": "22",
          "content": "Instrução Normativa Ibama nº 19, de 20 de agosto de 2018: referente à regulamentação do licenciamento ambiental federal do Uso e Manuseio de Radioisótopos - UMR;",
          "items": []
        },
        {
          "title": "23",
          "content": "Instrução Normativa Ibama nº 12, de 20 de agosto de 2021: referente ao Cadastro Técnico Federal de Atividades e Instrumentos de Defesa Ambiental – CTF/AIDA;",
          "items": []
        },
        {
          "title": "24",
          "content": "Instrução Normativa Ibama nº 13, de 23 de agosto de 2021: referente ao Cadastro Técnico Federal de Atividades Potencialmente Poluidoras e Utilizadoras de Recursos Ambientais – CTF/APP;",
          "items": []
        },
        {
          "title": "25",
          "content": "Instrução Normativa Ibama nº 22, de 22 de dezembro de 2021: referente ao Relatório Anual de Atividades Potencialmente Poluidoras e Utilizadoras de Recursos Ambientais – RAPP;",
          "items": []
        },
        {
          "title": "26",
          "content": "Instrução Normativa ICMBio nº 7, de 5 de novembro de 2014: referente aos procedimentos do Instituto Chico Mendes de Conservação da Biodiversidade nos processos de licenciamento ambiental;",
          "items": []
        },
        {
          "title": "27",
          "content": "ABNT NBR 12235:1992: Armazenamento de resíduos sólidos perigosos – Procedimento;",
          "items": []
        },
        {
          "title": "28",
          "content": "Portaria DNPM nº 237, de 18 de Outubro de 2001:referente às Normas Reguladoras de Mineração – NRM;",
          "items": []
        },
        {
          "title": "29",
          "content": "Portaria DNPM nº 155, de 12 de maio de 2016:referente à Consolidação Normativa do DNPM;",
          "items": []
        },
        {
          "title": "30",
          "content": "Norma CNEN NE 1.13: referente ao licenciamento de minas e usinas de beneficiamento de minérios de urânio e/ou tório;",
          "items": []
        },
        {
          "title": "31",
          "content": "Norma CNEN NN 4.01: referente aos requisitos de segurança e proteção radiológica para instalações mínero-industriais (NORM).",
          "items": []
        }
      ],
      "raw_content": "SEI/IBAMA - 16843956 - Ficha Técnica de Enquadramento\nMinistério do Meio Ambiente\nInstituto Brasileiro do Meio Ambiente e dos Recursos Naturais Renováveis\nCadastro Técnico Federal de Atividades Potencialmente Poluidoras e Utilizadoras de Recursos Ambientais – CTF/APP\nFICHA TÉCNICA DE ENQUADRAMENTO\nCódigo:\n1 – 2\nDescrição:\nLavra a céu aberto, inclusive de aluvião, com ou sem beneficiamento\nVersão FTE:\n1.4\nData:\n29/01/2024\nPP/GU:\nAlto\nTipo de pessoa:\nPessoa jurídica:\nSim\n(1)\nPessoa física:\nSim\n(1)\nA descrição compreende:\n(2)(3)(4)(5)\n- a extração de minerais metálicos por métodos de lavra a céu aberto;\n- a extração de minerais não-metálicos por métodos de lavra a céu aberto;\n- a extração de carvão mineral por métodos de lavra a céu aberto;\n- a extração de minerais para adubos e fertilizantes por método de lavra a céu aberto;\n- a extração de minerais radioativos (urânio, tório, areia monazítica, etc.) por métodos de lavra a céu aberto;\n(6)\n- a lavra minerária com a utilização de draga;\n- o depósito de resíduos perigosos, no mesmo estabelecimento em que ocorra a sua geração, e que serão expedidos para tratamento, destinação ou disposição;\n- o depósito para estocagem, no mesmo estabelecimento industrial em que ocorra a sua utilização, de produto perigoso que seja matéria-prima, insumo ou fonte de energia de processo industrial;\n- o tratamento de efluentes industriais no próprio estabelecimento industrial gerador de efluentes.\nÉ obrigada à inscrição no\nCadastro Técnico Federal de Atividades Potencialmente Poluidoras e Utilizadoras de Recursos Ambientais,\ndeclarando a atividade cód.\n1 – 2, a pessoa física ou jurídica que exerça atividade, em caráter permanente ou eventual, ou constitua empreendimento, conforme descrições no campo acima.\nA descrição não\ncompreende:\n(Para descrições com código em parênteses, consulte as respectivas FTE.)\n- a extração de substâncias minerais para análise e ensaios industriais antes da outorga da concessão de lavra, por meio de Guia de Utilização emitida pela Agência Nacional de Mineração – ANM (1 – 1);\n- a extração de minerais metálicos por métodos de lavra subterrânea (1 – 3);\n- a extração de minerais não-metálicos por métodos de lavra subterrânea (1 – 3);\n- a extração de minerais para adubos e fertilizantes por método de lavra subterrânea (1 – 3);\n- a extração de carvão mineral por métodos de lavra subterrânea (1 – 3);\n- a extração de minerais radioativos (urânio, tório, etc.) por métodos de lavra subterrânea (1 – 3);\n- a extração de minerais sob o regime de permissão lavra garimpeira (1 – 4);\n- a garimpagem com a utilização de draga (1 – 4);\n- a extração de xisto e areias betuminosas e todos os beneficiamentos associados à extração (1 – 5);\n- a garimpagem do ouro com a utilização de mercúrio metálico (1 – 7);\n- a garimpagem do ouro com a utilização de draga e mercúrio metálico (1 – 7);\n- a fabricação de águas minerais naturais e artificiais (16 – 13);\n- a extração, engarrafamento e gaseificação de águas minerais (16 – 13);\n- a dragagem e derrocamentos em corpos d'água (17 – 5);\n- a disposição final de rejeitos da indústria ou da mineração em confinamento licenciado pelo órgão ambiental competente (17 – 58);\n- a disposição final de rejeitos da mineração em barragem (17 – 58);\n- a disposição final de estéril em pilha (17 – 58);\n- o tratamento de resíduos de mineração (17 – 59);\n- a recuperação de áreas degradadas (17 – 67);\n- a recuperação de áreas contaminadas (17 – 68);\n- o tratamento e destinação de rejeitos radiativos (17 - 69);\n-  o sistema de rejeitos radiativos da lavra de minerais radiativos (17 – 69);\n- o transporte de combustível em empreendimento minerário por meio de caminhão-tanque (18 – 1);\n- o Posto de Abastecimento – PA (18 – 5);\n- o Depósito Fechado – DF para estocagem de produto perigoso que seja matéria-prima ou insumo de produção industrial (18 – 5);\n- o Depósito Fechado – DF para estocagem de produto perigoso resultante de produção industrial (18 – 5);\n- o transporte envolvendo material radioativo, obrigado à Autorização Ambiental de Transporte – AT, por qualquer modal de transporte (18 – 83);\n- o transporte de rejeito radioativo, obrigado à Autorização Ambiental de Transporte – AT, por qualquer modal de transporte (18 – 83);\n- o depósito de materiais nucleares (18 – 84);\n- a construção de barragens e diques para contenção de resíduos da atividade minerária (22 – 2);\n- a construção de barragens e diques para contenção de rejeitos da atividade minerária (22 – 2);\n- a construção de sistema de rejeitos radiativos da lavra de minerais radiativos (22 – 2);\n- a construção de canais para drenagem (22 – 3);\n- a retificação de curso de água (22 – 4);\n- a transposição de bacias hidrográficas (22 – 6);\n- a construção de obras de arte (22 – 7);\n- outras obras de infraestrutura (22 – 8);\n- os trabalhos de movimentação de terras e de desmonte de materiais\nin natura\n, que se fizerem necessários a obras de infraestrutura, desde que não haja comercialização das terras e dos materiais resultantes dos referidos trabalhos e ficando o seu aproveitamento restrito à utilização na própria obra (22 - 8).\nNão é obrigada à inscrição no\nCadastro Técnico Federal de Atividades Potencialmente Poluidoras e Utilizadoras de Recursos Ambientais,\nem razão da atividade cód.\n1 – 2, a pessoa física ou jurídica que exerça atividade ou constitua empreendimento, conforme descrições no campo acima.\nDefinições e linhas de corte:\n-\ndraga:\nembarcação própria para retirar depósitos do fundo do mar ou de rios, em portos ou canais, a fim de aumentar a profundidade nesses locais;\n-\nlavra:\nconjunto de operações coordenadas realizadas de forma racional, econômica e sustentável objetivando o aproveitamento da jazida até o beneficiamento associado ou em continuação à extração, realizado dentro da área de lavra, das substâncias minerais nela encontradas, inclusive, maximizando-se o seu valor ao final de sua vida útil;\n-\nmineral:\nsubstância sólida, de ocorrência natural, homogênea e com composição química e estrutura cristalina constantes e definidas.\nClassificação Nacional de Atividades Econômicas\n–\nCNAE:\nAgrupamento:\nCódigo:\nDescrição:\nDescritor\n0892-4/03\nCLORETO DE SÓDIO; MOAGEM, PURIFICAÇÃO, REFINO DE\nDescritor\n0892-4/03\nSAL (REFINADO, MOÍDO, ETC); PREPARAÇÃO DE (ASSOCIADO A EXTRAÇÃO)\nDescritor\n0892-4/03\nSAL DE SALINA; MOAGEM, PURIFICAÇÃO, REFINO DE\nDescritor\n0892-4/03\nSAL MARINHO; BENEFICIAMENTO DE\nDescritor\n0892-4/03\nSAL REFINADO (CLORETO DE SÓDIO); PREPARAÇÃO DE (ASSOCIADA À EXTRAÇÃO)\nSubclasse\n0500-3/01\nExtração de carvão mineral\nSubclasse\n0710-3/01\nExtração de minério de ferro\nSubclasse\n0721-9/01\nExtração de minério de alumínio\nSubclasse\n0722-7/01\nExtração de minério de estanho\nSubclasse\n0723-5/01\nExtração de minério de manganês\nSubclasse\n0724-3/01\nExtração de minério de metais preciosos\nSubclasse\n0725-1/00\nExtração de minerais radioativos\nSubclasse\n0729-4/01\nExtração de minérios de nióbio e titânio\nSubclasse\n0729-4/02\nExtração de minério de tungstênio\nSubclasse\n0729-4/03\nExtração de minério de níquel\nSubclasse\n0729-4/04\nExtração de minérios de cobre, chumbo, zinco e outros minerais metálicos não ferrosos não especificados anteriormente\nSubclasse\n0729-4/05\nBeneficiamento de minérios de cobre, chumbo, zinco e outros minerais metálicos não ferrosos não especificados anteriormente\nSubclasse\n0810-0/01\nExtração de ardósia e beneficiamento associado\nSubclasse\n0810-0/02\nExtração de granito e beneficiamento associado\nSubclasse\n0810-0/03\nExtração de mármore e beneficiamento associado\nSubclasse\n0810-0/04\nExtração de calcário e dolomita e beneficiamento associado\nSubclasse\n0810-0/05\nExtração de gesso e caulim\nSubclasse\n0810-0/06\nExtração de areia, cascalho ou pedregulho e beneficiamento associado\nSubclasse\n0810-0/07\nExtração de argila e beneficiamento associado\nSubclasse\n0810-0/08\nExtração de saibro e beneficiamento associado\nSubclasse\n0810-0/09\nExtração de basalto e beneficiamento associado\nSubclasse\n0810-0/10\nBeneficiamento de gesso e caulim associado à extração\nSubclasse\n0810-0/99\nExtração e britamento de pedras e outros materiais para construção e beneficiamento associado\nSubclasse\n0891-6/00\nExtração de minerais para fabricação de adubos, fertilizantes e outros produtos químicos\nSubclasse\n0892-4/02\nExtração de sal-gema\nSubclasse\n0893-2/00\nExtração de gemas (pedras preciosas e semipreciosas)\nSubclasse\n0899-1/01\nExtração de grafita\nSubclasse\n0899-1/02\nExtração de quartzo\nSubclasse\n0899-1/99\nExtração de outros minerais não metálicos não especificados anteriormente\nSubclasse\n0990-4/02\nAtividades de apoio à extração de minerais metálicos não ferrosos\nSubclasse\n0990-4/03\nAtividades de apoio à extração de minerais não metálicos\nA obrigação de inscrição, no Cadastro Técnico Federal de Atividades Potencialmente Poluidoras e Utilizadoras de Recursos Ambientais, não se vincula à Classificação Nacional de Atividades Econômicas, que pode ser utilizada como referência de enquadramento.\nOutras atividades do Cadastro Técnico Federal de Atividades Potencialmente Poluidoras e Utilizadoras de Recursos Ambientais,\nCadastros do Ibama e Relatório Anual de Atividades:\nCTF/APP:\nconsulte a relação de\nFichas Técnicas de Enquadramento\n.\nCNORP:\nsim.\nCTF/AIDA:\nsim.\nRAPP:\nsim.\nA declaração de atividades, no Cadastro Técnico Federal de Atividades Potencialmente Poluidoras e Utilizadoras de Recursos Ambientais, que sejam constantes do objeto social da empresa ou da inscrição no Cadastro Nacional da Pessoa Jurídica (CNPJ) não desobriga a pessoa jurídica de declarar outras atividades potencialmente poluidoras e utilizadoras de recursos ambientais que sejam exercidas pela empresa.\nObservações:\n(\n1)\nÉ obrigada à inscrição\nno Cadastro Técnico Federal de Atividades Potencialmente Poluidoras e Utilizadoras de Recursos Ambientais, a pessoa titular da concessão da lavra, seja pessoa física, seja pessoa jurídica, inclusive as cooperativas minerárias;\n(2)\nnos termos da Instrução Normativa Ibama nº 19, de 2018, a exploração mineral que for classificada como instalação mínero-industrial da Categoria 1 (NORM) é obrigada ao Licenciamento Ambiental Federal do Uso e Manuseio de Radioisótopos - LAF/UMR;\n(3)\nnos termos da Instrução Normativa Ibama nº 19, de 2018, a exploração mineral que for classificada como instalação mínero-industrial da Categoria 2 (NORM) é obrigada ao LAF/UMR;\n(4)\nnos termos da Instrução Normativa Ibama nº 19, de 2018, a exploração mineral que for classificada como instalação mínero-industrial da Categoria 3 (NORM) é obrigada ao LAF/UMR;\n(5)\nnos termos da Instrução Normativa Ibama nº 19, de 2018, não é obrigada ao LAF/UMR a instalação mínero-industrial das séries naturais do Urânio e/ou Tório em concentração total de até 10Bq/g;\n(6)\ninclui as atividades de pesquisa minerária de radiativos.\nReferências normativas:\n1\nLei Complementar nº 140, de 8 de dezembro de 20\n1\n1\n: art. 7º, XIV, “g”: referente ao licenciamento ambiental de lavra envolvendo material radioativo, mediante parecer da Comissão Nacional de Energia Nuclear – CNEN;\n2\nLei nº 4.118, de 27 de agosto de 1962\n(e alterações): referente à Política Nacional de Energia Nuclear;\n3\nDecreto-Lei nº 227, de 28 de fevereiro de 1967\n(e alterações): referente ao Código de Minas;\n4\nLei nº 6.189, de 16 de dezembro de 1974\n(e alterações): referente ao escopo do licenciamento nuclear, sob competência da Comissão Nacional de Energia Nuclear – CNEN;\n5\nLei nº\n6.567, de 24 de setembro de 1978\n: referente ao regime de exploração e aproveitamento de areias, cascalhos, saibros e argilas, em área máxima de cinquenta hectares;\n6\nLei nº 6.938, de 31 de agosto de 1981\n(e alterações): art. 9º, XII; art. 17, II; Anexo VIII;\n7\nLei nº 12.305, de 2 de agosto de 2010\n: referente à Política Nacional de Resíduos Sólidos e ao Cadastro Nacional de Operadores de Resíduos Perigosos – CNORP;\n8\nDecreto nº 97.632, de 10 de abril de 1989\n: referente à exigência de plano de recuperação de área degradada para os empreendimentos de exploração de recursos minerais;\n9\nResolução CONAMA nº 1, de 23 de janeiro de 1986:\nart. 2º, IX: referente ao impacto ambiental da extração de minério, sujeita à Estudo de Impacto Ambiental e Relatório de Impacto Ambiental – EIA/RIMA;\n10\nResolução CONAMA nº 5, de 15 de junho de 1989 (e complementações):\nreferente ao Programa Nacional de Controle da Qualidade do Ar - PRONAR, um dos instrumentos básicos da gestão ambiental para proteção da saúde e bem-estar das populações e melhoria da qualidade de vida com o objetivo de permitir o desenvolvimento econômico e social do País de forma ambientalmente segura, pela limitação dos níveis de emissão de poluentes por fontes de poluição atmosférica;\n11\nResolução CONAMA nº 237, de 19 de dezembro de 1997:\nreferente à prevenção e ao controle de poluição da atividade Lavra a céu aberto, inclusive de aluvião, com ou sem beneficiamento, por meio de licenciamento ambiental;\n12\nResolução CONAMA nº 369, de 28 de março de 2006:\nreferente à intervenção ou supressão de vegetação em Área de Preservação Permanente – APP em caráter excepcional de utilidade pública;\n13\nResolução CONAMA nº 382, de 26 de dezembro de 2006 (e complementações):\nreferente ao controle ambiental da emissão de poluentes atmosféricos para fontes fixas;\n14\nResolução CONAMA nº 428, de 17 de dezembro de 2010 (e alterações):\nreferente à autorização de licenciamento ambiental pelos órgãos responsáveis por Unidades de Conservação;\n15\nResolução CONAMA nº 436, de 22 de dezembro de 2011: ANEXO XIII:\nreferente aos limites de emissão para poluentes atmosféricos gerados nas usinas de pelotização de minério de ferro instaladas ou com pedido de licença de instalação anteriores a 2 de janeiro de 2007;\n16\nPortaria MMA\nn\nº 55, de 17 de fevereiro de 2014\n:\nreferente aos procedimentos entre o Instituto Chico Mendes de Conservação da Biodiversidade - Instituto Chico Mendes e o Instituto Brasileiro do Meio Ambiente e dos Recursos Naturais Renováveis - IBAMA relacionados à Resolução nº 428, de 17 de dezembro de 2010, do Conselho Nacional do Meio Ambiente – CONAMA, no âmbito do licenciamento ambiental federal;\n17\nInstrução Normativa Ibama nº 184, de 17 de julho de 2008 (e alterações): referente aos procedimentos para o licenciamento ambiental federal;\n18\nInstrução Normativa Ibama nº 184, de 17 de julho de 2008 (e alterações): art. 35-A: referente à obrigação de atualização, no que couber, de atividades potencialmente poluidoras e utilizadoras de recursos ambientais no CTF/APP, quando da emissão da Licença de Operação – LO;\n19\nInstrução Normativa Ibama nº 13, de 18 de dezembro de 2012\n: referente à Lista Brasileira de Resíduos Sólidos;\n20\nInstrução Normativa Ibama nº 1, de 25 de janeiro de 2013\n:\nreferente ao Cadastro Nacional de Operadores de Resíduos Perigosos – CNORP;\n21\nInstrução Normativa Ibama nº 15, de 6 de outubro de 2014\n: referente ao Sistema Nacional de Emergências Ambientais – SIEMA e às comunicações de acidentes ambientais;\n22\nInstrução Normativa Ibama nº 19, de 20 de agosto de 2018\n: referente à regulamentação do licenciamento ambiental federal do Uso e Manuseio de Radioisótopos - UMR;\n23\nInstrução Normativa Ibama nº 12, de 20 de agosto de 2021\n: referente ao Cadastro Técnico Federal de Atividades e Instrumentos de Defesa Ambiental – CTF/AIDA;\n24\nInstrução Normativa Ibama nº 13, de 23 de agosto de 2021\n: referente ao Cadastro Técnico Federal de Atividades Potencialmente Poluidoras e Utilizadoras de Recursos Ambientais – CTF/APP;\n25\nInstrução Normativa Ibama nº 22, de 22 de dezembro de 2021\n: referente ao Relatório Anual de Atividades Potencialmente Poluidoras e Utilizadoras de Recursos Ambientais – RAPP;\n26\nInstrução Normativa ICMBio nº 7, de 5 de novembro de 2014\n: referente aos procedimentos do Instituto Chico Mendes de Conservação da Biodiversidade nos processos de licenciamento ambiental;\n27\nABNT NBR 12235:1992\n: Armazenamento de resíduos sólidos perigosos – Procedimento;\n28\nPortaria DNPM nº 237, de 18 de Outubro de 2001\n:\nreferente às Normas Reguladoras de Mineração – NRM;\n29\nPortaria DNPM nº 155, de 12 de maio de 2016\n:\nreferente à Consolidação Normativa do DNPM;\n30\nNorma CNEN NE 1.13\n: referente ao licenciamento de minas e usinas de beneficiamento de minérios de urânio e/ou tório;\n31\nNorma CNEN NN 4.01\n: referente aos requisitos de segurança e proteção radiológica para instalações mínero-industriais (NORM).\nDocumento assinado eletronicamente por\nRODRIGO ANTONIO DE AGOSTINHO MENDONÇA\n,\nPresidente\n, em 06/02/2024, às 18:09, conforme horário oficial de Brasília, com fundamento no art. 6º, § 1º, do\nDecreto nº 8.539, de 8 de outubro de 2015\n.\nA autenticidade deste documento pode ser conferida no site\nhttps://sei.ibama.gov.br/autenticidade\n, informando o código verificador\n16843956\ne o código CRC\nDBAB2BC2\n.\nReferência:\nProcesso nº 02001.001889/2018-03\nSEI nº 16843956",
      "Classificação Nacional de Atividades Econômicas": [
        {
          "agrupamento": "descritor",
          "código": "0892-4/03",
          "descricao": "CLORETO DE SÓDIO; MOAGEM, PURIFICAÇÃO, REFINO DE"
        },
        {
          "agrupamento": "descritor",
          "código": "0892-4/03",
          "descricao": "CLORETO DE SÓDIO; MOAGEM, PURIFICAÇÃO, REFINO DE"
        },
        {
          "agrupamento": "descritor",
          "código": "0892-4/03",
          "descricao": "CLORETO DE SÓDIO; MOAGEM, PURIFICAÇÃO, REFINO DE"
        },
        {
          "agrupamento": "descritor",
          "código": "0892-4/03",
          "descricao": "CLORETO DE SÓDIO; MOAGEM, PURIFICAÇÃO, REFINO DE"
        },
        {
          "agrupamento": "descritor",
          "código": "0892-4/03",
          "descricao": "CLORETO DE SÓDIO; MOAGEM, PURIFICAÇÃO, REFINO DE"
        },
        {
          "agrupamento": "subclasse",
          "código": "0500-3/01",
          "descricao": "Extração de carvão mineral"
        },
        {
          "agrupamento": "subclasse",
          "código": "0710-3/01",
          "descricao": "Extração de minério de ferro"
        },
        {
          "agrupamento": "subclasse",
          "código": "0721-9/01",
          "descricao": "Extração de minério de alumínio"
        },
        {
          "agrupamento": "subclasse",
          "código": "0722-7/01",
          "descricao": "Extração de minério de estanho"
        },
        {
          "agrupamento": "subclasse",
          "código": "0723-5/01",
          "descricao": "Extração de minério de manganês"
        },
        {
          "agrupamento": "subclasse",
          "código": "0724-3/01",
          "descricao": "Extração de minério de metais preciosos"
        },
        {
          "agrupamento": "subclasse",
          "código": "0725-1/00",
          "descricao": "Extração de minerais radioativos"
        },
        {
          "agrupamento": "subclasse",
          "código": "0729-4/01",
          "descricao": "Extração de minérios de nióbio e titânio"
        },
        {
          "agrupamento": "subclasse",
          "código": "0729-4/02",
          "descricao": "Extração de minério de tungstênio"
        },
        {
          "agrupamento": "subclasse",
          "código": "0729-4/03",
          "descricao": "Extração de minério de níquel"
        },
        {
          "agrupamento": "subclasse",
          "código": "0729-4/04",
          "descricao": "Extração de minérios de cobre, chumbo, zinco e outros minerais metálicos não ferrosos não especificados anteriormente"
        },
        {
          "agrupamento": "subclasse",
          "código": "0729-4/05",
          "descricao": "Beneficiamento de minérios de cobre, chumbo, zinco e outros minerais metálicos não ferrosos não especificados anteriormente"
        },
        {
          "agrupamento": "subclasse",
          "código": "0810-0/01",
          "descricao": "Extração de ardósia e beneficiamento associado"
        },
        {
          "agrupamento": "subclasse",
          "código": "0810-0/02",
          "descricao": "Extração de granito e beneficiamento associado"
        },
        {
          "agrupamento": "subclasse",
          "código": "0810-0/03",
          "descricao": "Extração de mármore e beneficiamento associado"
        },
        {
          "agrupamento": "subclasse",
          "código": "0810-0/04",
          "descricao": "Extração de calcário e dolomita e beneficiamento associado"
        },
        {
          "agrupamento": "subclasse",
          "código": "0810-0/05",
          "descricao": "Extração de gesso e caulim"
        },
        {
          "agrupamento": "subclasse",
          "código": "0810-0/06",
          "descricao": "Extração de areia, cascalho ou pedregulho e beneficiamento associado"
        },
        {
          "agrupamento": "subclasse",
          "código": "0810-0/07",
          "descricao": "Extração de argila e beneficiamento associado"
        },
        {
          "agrupamento": "subclasse",
          "código": "0810-0/08",
          "descricao": "Extração de saibro e beneficiamento associado"
        },
        {
          "agrupamento": "subclasse",
          "código": "0810-0/09",
          "descricao": "Extração de basalto e beneficiamento associado"
        },
        {
          "agrupamento": "subclasse",
          "código": "0810-0/10",
          "descricao": "Beneficiamento de gesso e caulim associado à extração"
        },
        {
          "agrupamento": "subclasse",
          "código": "0810-0/99",
          "descricao": "Extração e britamento de pedras e outros materiais para construção e beneficiamento associado"
        },
        {
          "agrupamento": "subclasse",
          "código": "0891-6/00",
          "descricao": "Extração de minerais para fabricação de adubos, fertilizantes e outros produtos químicos"
        },
        {
          "agrupamento": "subclasse",
          "código": "0892-4/02",
          "descricao": "Extração de sal-gema"
        },
        {
          "agrupamento": "subclasse",
          "código": "0893-2/00",
          "descricao": "Extração de gemas (pedras preciosas e semipreciosas)"
        },
        {
          "agrupamento": "subclasse",
          "código": "0899-1/01",
          "descricao": "Extração de grafita"
        },
        {
          "agrupamento": "subclasse",
          "código": "0899-1/02",
          "descricao": "Extração de quartzo"
        },
        {
          "agrupamento": "subclasse",
          "código": "0899-1/99",
          "descricao": "Extração de outros minerais não metálicos não especificados anteriormente"
        },
        {
          "agrupamento": "subclasse",
          "código": "0990-4/02",
          "descricao": "Atividades de apoio à extração de minerais metálicos não ferrosos"
        },
        {
          "agrupamento": "subclasse",
          "código": "0990-4/03",
          "descricao": "Atividades de apoio à extração de minerais não metálicos"
        }
      ]
    }
  },
  {
    "url": "https://sei.ibama.gov.br/documento_consulta_externa.php?id_acesso_externo=1261113&id_documento=18738743&infra_hash=f9e8e34109de702e7fab24a47c90639a",
    "data": {
      "metadata": {
        "Código:": "1 – 3",
        "Versão FTE:": "1.4"
      },
      "sections": [
        {
          "title": "PP/GU:",
          "content": "Alto",
          "items": []
        },
        {
          "title": "Subclasse",
          "content": "0500-3/01",
          "items": []
        },
        {
          "title": "Subclasse",
          "content": "0710-3/01",
          "items": []
        },
        {
          "title": "Subclasse",
          "content": "0721-9/01",
          "items": []
        },
        {
          "title": "Subclasse",
          "content": "0723-5/01",
          "items": []
        },
        {
          "title": "Subclasse",
          "content": "0724-3/01",
          "items": []
        },
        {
          "title": "Subclasse",
          "content": "0725-1/00",
          "items": []
        },
        {
          "title": "Subclasse",
          "content": "0729-4/01",
          "items": []
        },
        {
          "title": "Subclasse",
          "content": "0729-4/02",
          "items": []
        },
        {
          "title": "Subclasse",
          "content": "0729-4/03",
          "items": []
        },
        {
          "title": "Subclasse",
          "content": "0729-4/04",
          "items": []
        },
        {
          "title": "Subclasse",
          "content": "0729-4/05",
          "items": []
        },
        {
          "title": "Subclasse",
          "content": "0810-0/01",
          "items": []
        },
        {
          "title": "Subclasse",
          "content": "0810-0/02",
          "items": []
        },
        {
          "title": "Subclasse",
          "content": "0810-0/03",
          "items": []
        },
        {
          "title": "Subclasse",
          "content": "0891-6/00",
          "items": []
        },
        {
          "title": "Subclasse",
          "content": "0892-4/02",
          "items": []
        },
        {
          "title": "Subclasse",
          "content": "0893-2/00",
          "items": []
        },
        {
          "title": "Subclasse",
          "content": "0899-1/01",
          "items": []
        },
        {
          "title": "Subclasse",
          "content": "0899-1/02",
          "items": []
        },
        {
          "title": "Subclasse",
          "content": "0899-1/99",
          "items": []
        },
        {
          "title": "Subclasse",
          "content": "0990-4/02",
          "items": []
        },
        {
          "title": "Subclasse",
          "content": "0990-4/03",
          "items": []
        },
        {
          "title": "CTF/APP:",
          "content": "consulte a relação deFichas Técnicas de Enquadramento.",
          "items": []
        },
        {
          "title": "CNORP:",
          "content": "sim.",
          "items": []
        },
        {
          "title": "CTF/AIDA:",
          "content": "sim.",
          "items": []
        },
        {
          "title": "RAPP:",
          "content": "sim.",
          "items": []
        },
        {
          "title": "1",
          "content": "Lei Complementar nº 140, de 8 de dezembro de 2011: art. 7º, XIV, “g”: referente ao licenciamento ambiental de lavra envolvendo material radioativo, mediante parecer da Comissão Nacional de Energia Nuclear – CNEN;",
          "items": []
        },
        {
          "title": "2",
          "content": "Lei nº 4.118, de 27 de agosto de 1962(e alterações): referente à Política Nacional de Energia Nuclear;",
          "items": []
        },
        {
          "title": "3",
          "content": "Decreto-Lei nº 227, de 28 de fevereiro de 1967(e alterações): referente ao Código de Minas;",
          "items": []
        },
        {
          "title": "4",
          "content": "Lei nº 6.189, de 16 de dezembro de 1974(e alterações): referente ao escopo do licenciamento nuclear, sob competência da Comissão Nacional de Energia Nuclear – CNEN;",
          "items": []
        },
        {
          "title": "5",
          "content": "Lei nº6.567, de 24 de setembro de 1978: referente ao regime de exploração e aproveitamento de areias, cascalhos, saibros e argilas, em área máxima de cinquenta hectares;",
          "items": []
        },
        {
          "title": "6",
          "content": "Lei nº 6.938, de 31 de agosto de 1981(e alterações): art. 9º, XII; art. 17, II; Anexo VIII;",
          "items": []
        },
        {
          "title": "7",
          "content": "Lei nº 12.305, de 2 de agosto de 2010: referente à Política Nacional de Resíduos Sólidos e ao Cadastro Nacional de Operadores de Resíduos Perigosos – CNORP;",
          "items": []
        },
        {
          "title": "8",
          "content": "Decreto nº 97.632, de 10 de abril de 1989: referente à exigência de plano de recuperação de área degradada para os empreendimentos de exploração de recursos minerais;",
          "items": []
        },
        {
          "title": "9",
          "content": "Decreto nº 9.406, de 12 de junho de 2018: referente à regulamentação do Código de Minas;",
          "items": []
        },
        {
          "title": "10",
          "content": "Decreto nº 10.935, de 12 de janeiro de 2022: referente à proteção das cavidades naturais subterrâneas existentes no território nacional;",
          "items": []
        },
        {
          "title": "11",
          "content": "Resolução CONAMA nº 1, de 23 de janeiro de 1986: art. 2º, IX:referente ao impacto ambiental da extração de minério, sujeita à Estudo de Impacto Ambiental e Relatório de Impacto Ambiental – EIA/RIMA;",
          "items": []
        },
        {
          "title": "12",
          "content": "Resolução CONAMA nº 237, de 19 de dezembro de 1997:referente à prevenção e ao controle de poluição da atividade Lavra subterrânea com ou sem beneficiamento, por meio de licenciamento ambiental;",
          "items": []
        },
        {
          "title": "13",
          "content": "Resolução CONAMA nº 347, de 10 de setembro de 2004 (e alterações):referente a procedimentos de monitoramento e de controle ambiental para minimizar a degradação e a destruição de cavidades naturais subterrâneas e de outros ecossistemas a elas associados;",
          "items": []
        },
        {
          "title": "14",
          "content": "Resolução CONAMA nº 428, de 17 de dezembro de 2010 (e alterações):referente à autorização de licenciamento ambiental pelos órgãos responsáveis por Unidades de Conservação;",
          "items": []
        },
        {
          "title": "15",
          "content": "Instrução Normativa MMA nº 2, de 20 de agosto de 2009: referente à classificação do grau de relevância das cavidades naturais subterrâneas;",
          "items": []
        },
        {
          "title": "16",
          "content": "Portaria MMAnº 55, de 17 de fevereiro de 2014: referente aos procedimentos entre o Instituto Chico Mendes de Conservação da Biodiversidade - Instituto Chico Mendes e o Instituto Brasileiro do Meio Ambiente e dos Recursos Naturais Renováveis - IBAMA relacionados à Resolução nº 428, de 17 de dezembro de 2010, do Conselho Nacional do Meio Ambiente – CONAMA, no âmbito do licenciamento ambiental federal;",
          "items": []
        },
        {
          "title": "17",
          "content": "Instrução Normativa Ibama nº 184,de17 de julhode 2008(e alterações): referente aos procedimentos para o licenciamento ambiental federal;",
          "items": []
        },
        {
          "title": "18",
          "content": "Instrução Normativa Ibama nº 184, de 17 de julho de 2008 (e alterações): art. 35-A: referente à obrigação de atualização, no que couber, de atividades potencialmente poluidoras e utilizadoras de recursos ambientais no CTF/APP, quando da emissão da Licença de Operação – LO;",
          "items": []
        },
        {
          "title": "19",
          "content": "Instrução Normativa Ibama nº 13, de 18 de dezembro de 2012: referente à Lista Brasileira de Resíduos Sólidos;",
          "items": []
        },
        {
          "title": "20",
          "content": "Instrução Normativa Ibama nº 1, de 25 de janeiro de 2013:referente ao Cadastro Nacional de Operadores de Resíduos Perigosos – CNORP;",
          "items": []
        },
        {
          "title": "21",
          "content": "Instrução Normativa Ibama nº 15, de 6 de outubro de 2014: referente ao Sistema Nacional de Emergências Ambientais – SIEMA e às comunicações de acidentes ambientais;",
          "items": []
        },
        {
          "title": "22",
          "content": "Instrução Normativa Ibama nº 19, de 20 de agosto de 2018: referente à regulamentação do licenciamento ambiental federal do Uso e Manuseio de Radioisótopos - UMR;",
          "items": []
        },
        {
          "title": "23",
          "content": "Instrução Normativa Ibama nº 12, de 20 de agosto de 2021: referente ao Cadastro Técnico Federal de Atividades e Instrumentos de Defesa Ambiental – CTF/AIDA;",
          "items": []
        },
        {
          "title": "24",
          "content": "Instrução Normativa Ibama nº 13, de 23 de agosto de 2021: referente ao Cadastro Técnico Federal de Atividades Potencialmente Poluidoras e Utilizadoras de Recursos Ambientais – CTF/APP;",
          "items": []
        },
        {
          "title": "25",
          "content": "Instrução Normativa Ibama nº 22, de 22 de dezembro de 2021: referente ao Relatório Anual de Atividades Potencialmente Poluidoras e Utilizadoras de Recursos Ambientais – RAPP;",
          "items": []
        },
        {
          "title": "26",
          "content": "Instrução Normativa ICMBio nº 30, de 19 de setembro de 2012: referente aos procedimentos administrativos e técnicos na hipótese de empreendimento que ocasione impacto negativo irreversível em cavidades naturais subterrâneas classificada com grau de relevância alto;",
          "items": []
        },
        {
          "title": "27",
          "content": "Instrução Normativa ICMBio nº 7, de 5 de novembro de 2014: Capítulo V: referente aos procedimentos do Instituto Chico Mendes de Conservação da Biodiversidade relativos aos licenciamentos que afetem cavidades naturais subterrâneas em Unidades de Conservação Federal;",
          "items": []
        },
        {
          "title": "28",
          "content": "ABNT NBR 12235:1992: Armazenamento de resíduos sólidos perigosos – Procedimento;",
          "items": []
        },
        {
          "title": "29",
          "content": "Portaria ANM nº 819 de 03 de dezembro de 2018: Estabelece instruções sobre análises oficiais de fontes de água mineral, termal, gasosa, potável de mesa ou destinada a fins balneários;",
          "items": []
        },
        {
          "title": "30",
          "content": "Portaria DNPM nº 237, de 18 de outubro 2001: (e alterações):referente às Normas Reguladoras de Mineração – NRM;",
          "items": []
        },
        {
          "title": "31",
          "content": "Portaria DNPM n° 155, de 12 de maio de 2016:referente à Consolidação Normativa do DNPM;",
          "items": []
        },
        {
          "title": "32",
          "content": "Norma CNEN NE 1.13: referente ao licenciamento de minas e usinas de beneficiamento de minérios de urânio e/ou tório;",
          "items": []
        },
        {
          "title": "33",
          "content": "Norma CNEN NN 4.01: referente aos requisitos de segurança e proteção radiológica para instalações mínero-industriais (NORM).",
          "items": []
        }
      ],
      "raw_content": "SEI/IBAMA - 17021438 - Ficha Técnica de Enquadramento\nMinistério do Meio Ambiente\nInstituto Brasileiro do Meio Ambiente e dos Recursos Naturais Renováveis\nCadastro Técnico Federal de Atividades Potencialmente Poluidoras e Utilizadoras de Recursos Ambientais – CTF/APP\nFICHA TÉCNICA DE ENQUADRAMENTO\nCódigo:\n1 – 3\nDescrição:\nLavra subterrânea com ou sem beneficiamento\nVersão FTE:\n1.4\nData:\n29/01/2024\nPP/GU:\nAlto\nTipo de pessoa:\nPessoa jurídica:\nSim\n(1)\nPessoa física:\nNão\nA descrição compreende:\n(2)(3)(4)(5)\n- a extração de minerais metálicos por métodos de lavra subterrânea;\n- a extração de minerais não-metálicos por métodos de lavra subterrânea;\n- a extração de minerais para adubos e fertilizantes por método de lavra subterrânea;\n- a extração de carvão mineral por métodos de lavra subterrânea;\n- a extração de minerais radioativos (urânio, tório, etc.) por métodos de lavra subterrânea;\n(6)\n- o depósito de resíduos perigosos, no mesmo estabelecimento em que ocorra a sua geração, e que serão expedidos para tratamento, destinação ou disposição;\n- o depósito para estocagem, no mesmo estabelecimento industrial em que ocorra a sua utilização, de produto perigoso que seja matéria-prima, insumo ou fonte de energia de processo industrial;\n- o tratamento de efluentes industriais no próprio estabelecimento industrial gerador de efluentes.\nÉ obrigada à inscrição no\nCadastro Técnico Federal de Atividades Potencialmente Poluidoras e Utilizadoras de Recursos Ambientais\n,\ndeclarando a atividade cód.\n1 – 3, a pessoa jurídica que exerça atividade, em caráter permanente ou eventual, ou constitua empreendimento, conforme descrições no campo acima.\nA descrição não\ncompreende:\n(Para descrições com código em parênteses, consulte as respectivas FTE.)\n- a extração de substâncias minerais para análise e ensaios industriais antes da outorga da concessão de lavra, por meio de Guia de Utilização emitida pela Agência Nacional de Mineração – ANM (1 – 1);\n- a extração de minerais metálicos por métodos de lavra a céu aberto (1 – 2);\n- a extração de minerais não-metálicos por métodos de lavra a céu aberto (1 – 2);\n- a extração de carvão mineral por métodos de lavra a céu aberto (1 – 2);\n- a extração de minerais para adubos e fertilizantes por método de lavra a céu aberto (1 – 2);\n- a extração de minerais radioativos (urânio, tório, areia monazítica, etc.) por métodos de lavra a céu aberto (1 – 2);\n- a lavra minerária com a utilização de draga (1 – 2);\n- a extração de minerais sob o regime de permissão lavra garimpeira (1 – 4);\n- a extração de xisto e areias betuminosas e todos os beneficiamentos associados à extração (1 – 5);\n- a garimpagem do ouro com a utilização de mercúrio metálico (1 – 7);\n- a fabricação de águas minerais naturais e artificiais (16 – 13);\n- a extração, engarrafamento e gaseificação de águas minerais (16 – 13);\n- a disposição final de rejeitos da indústria ou da mineração em confinamento licenciado pelo órgão ambiental competente (17 – 58);\n- a disposição final de rejeitos da mineração em barragem (17 – 58);\n- a disposição final de estéril em pilha (17 – 58);\n- o tratamento de resíduos de mineração (17 – 59);\n- a recuperação de áreas degradadas (17 – 67);\n- a recuperação de áreas contaminadas (17 – 68);\n- o tratamento e destinação de rejeitos radiativos (17 - 69);\n-  o sistema de rejeitos radiativos da lavra de minerais radiativos (17 – 69);\n- o transporte de combustível em empreendimento minerário por meio de caminhão-tanque (18 – 1);\n- o Posto de Abastecimento – PA (18 – 5);\n- o Depósito Fechado – DF para estocagem de produto perigoso que seja matéria-prima ou insumo de produção industrial (18 – 5);\n- o Depósito Fechado – DF para estocagem de produto perigoso resultante de produção industrial (18 – 5);\n- o transporte envolvendo material radioativo, obrigado à Autorização Ambiental de Transporte – AT, por qualquer modal de transporte (18 – 83);\n- o transporte de rejeito radioativo, obrigado à Autorização Ambiental de Transporte – AT, por qualquer modal de transporte (18 – 83);\n- o depósito de materiais nucleares (18 – 84);\n- a construção de barragens e diques para contenção de resíduos da atividade minerária (22 – 2);\n- a construção de barragens e diques para contenção de rejeitos da atividade minerária (22 – 2);\n- a construção de sistema de rejeitos radiativos da lavra de minerais radiativos (22 – 2);\n- a construção de canais para drenagem (22 – 3);\n- a retificação de curso de água (22 – 4);\n- a transposição de bacias hidrográficas (22 – 6);\n- a construção de obras de arte (22 – 7);\n- outras obras de infraestrutura (22 – 8).\nNão é obrigada à inscrição no\nCadastro Técnico Federal de Atividades Potencialmente Poluidoras e Utilizadoras de Recursos Ambientais\n,\nem razão da atividade cód.\n1 – 3, a pessoa jurídica que exerça atividade ou constitua empreendimento, conforme descrições no campo acima.\nDefinições e linhas de corte:\n-\nlavra:\nconjunto de operações coordenadas realizadas de forma racional, econômica e sustentável objetivando o aproveitamento da jazida até o beneficiamento associado ou em continuação à extração, realizado dentro da área de lavra, das substâncias minerais nela encontradas, inclusive, maximizando-se o seu valor ao final de sua vida útil;\n-\nmineral:\nsubstância sólida, de ocorrência natural, homogênea e com composição química e estrutura cristalina constantes e definidas.\n- regime de autorização\n: destinado às atividades de pesquisa mineral, outorgada por ato da Agência Nacional de Mineração;\n- regime de concessão\n: destinado às atividades de lavra mineral precedidas de pesquisa, outorgada por ato do Ministro de Estado de Minas e Energia, ou da Agência Nacional de Mineração, na hipótese de a concessão ter por objeto as substâncias minerais de que trata o art. 1º da Lei nº 6.567, de 1978;\n- regime de lavra garimpeira\n: destinado à atividade de lavra mineral prevista na Lei nº 7.805, de 1989, outorgada por título expedido pela Agência Nacional de Mineração;\n- regime de licenciamento\n: destinado às atividades de lavra das substâncias minerais de que trata o art. 1º da Lei nº 6.567, de 1978, outorgado por licença expedida em conformidade com regulamentos administrativos locais e por registro da licença na Agência Nacional de Mineração;\n- regime de monopolização\n: quando, em decorrência de lei especial, o aproveitamento de recursos minerais depender de execução direta ou indireta do Poder Executivo federal.\nClassificação Nacional de Atividades Econômicas\n–\nCNAE:\nAgrupamento:\nCódigo:\nDescrição:\nSubclasse\n0500-3/01\nExtração de carvão mineral\nSubclasse\n0710-3/01\nExtração de minério de ferro\nSubclasse\n0721-9/01\nExtração de minério de alumínio\nSubclasse\n0723-5/01\nExtração de minério de manganês\nSubclasse\n0724-3/01\nExtração de minério de metais preciosos\nSubclasse\n0725-1/00\nExtração de minerais radioativos\nSubclasse\n0729-4/01\nExtração de minérios de nióbio e titânio\nSubclasse\n0729-4/02\nExtração de minério de tungstênio\nSubclasse\n0729-4/03\nExtração de minério de níquel\nSubclasse\n0729-4/04\nExtração de minérios de cobre, chumbo, zinco e outros minerais metálicos não ferrosos não especificados anteriormente\nSubclasse\n0729-4/05\nBeneficiamento de minérios de cobre, chumbo, zinco e outros minerais metálicos não ferrosos não especificados anteriormente\nSubclasse\n0810-0/01\nExtração de ardósia e beneficiamento associado\nSubclasse\n0810-0/02\nExtração de granito e beneficiamento associado\nSubclasse\n0810-0/03\nExtração de mármore e beneficiamento associado\nSubclasse\n0891-6/00\nExtração de minerais para fabricação de adubos, fertilizantes e outros produtos químicos\nSubclasse\n0892-4/02\nExtração de sal-gema\nSubclasse\n0893-2/00\nExtração de gemas (pedras preciosas e semipreciosas)\nSubclasse\n0899-1/01\nExtração de grafita\nSubclasse\n0899-1/02\nExtração de quartzo\nSubclasse\n0899-1/99\nExtração de outros minerais não metálicos não especificados anteriormente\nSubclasse\n0990-4/02\nAtividades de apoio à extração de minerais metálicos não ferrosos\nSubclasse\n0990-4/03\nAtividades de apoio à extração de minerais não metálicos\nA obrigação de inscrição, no Cadastro Técnico Federal de Atividades Potencialmente Poluidoras e Utilizadoras de Recursos Ambientais, não se vincula à Classificação Nacional de Atividades Econômicas, que pode ser utilizada como referência de enquadramento.\nOutras atividades do Cadastro Técnico Federal de Atividades Potencialmente Poluidoras e Utilizadoras de Recursos Ambientais\n, Cadastros do Ibama e Relatório Anual de Atividades:\nCTF/APP:\nconsulte a relação de\nFichas Técnicas de Enquadramento.\nCNORP:\nsim.\nCTF/AIDA:\nsim.\nRAPP:\nsim.\nA declaração de atividades, no Cadastro Técnico Federal de Atividades Potencialmente Poluidoras e Utilizadoras de Recursos Ambientais, que sejam constantes do objeto social da empresa ou da inscrição no Cadastro Nacional da Pessoa Jurídica (CNPJ) não desobriga a pessoa jurídica de declarar outras atividades potencialmente poluidoras e utilizadoras de recursos ambientais que sejam exercidas pela empresa.\nObservações:\n(1)\nÉ obrigada à inscrição\nno Cadastro Técnico Federal de Atividades Potencialmente Poluidoras e Utilizadoras de Recursos Ambientais, a pessoa jurídica titular da concessão da lavra, inclusive as cooperativas minerárias;\n(2)\nnos termos da Instrução Normativa Ibama nº 19, de 2018, a exploração mineral que for classificada como instalação mínero-industrial da Categoria 1 (NORM) é obrigada ao Licenciamento Ambiental Federal do Uso e Manuseio de Radioisótopos - LAF/UMR;\n(3)\nnos termos da Instrução Normativa Ibama nº 19, de 2018, a exploração mineral que for classificada como instalação mínero-industrial da Categoria 2 (NORM) é obrigada ao LAF/UMR;\n(4)\nnos termos da Instrução Normativa Ibama nº 19, de 2018, a exploração mineral que for classificada como instalação mínero-industrial da Categoria 3 (NORM) é obrigada ao LAF/UMR;\n(5)\nnos termos da Instrução Normativa Ibama nº 19, de 2018, não é obrigada ao LAF/UMR a instalação mínero-industrial das séries naturais do Urânio e/ou Tório em concentração total de até 10Bq/g;\n(6)\ninclui as atividades de pesquisa minerária de radiativos.\nReferências normativas:\n1\nLei Complementar nº 140, de 8 de dezembro de 20\n1\n1\n: art. 7º, XIV, “g”: referente ao licenciamento ambiental de lavra envolvendo material radioativo, mediante parecer da Comissão Nacional de Energia Nuclear – CNEN;\n2\nLei nº 4.118, de 27 de agosto de 1962\n(e alterações): referente à Política Nacional de Energia Nuclear;\n3\nDecreto-Lei nº 227, de 28 de fevereiro de 1967\n(e alterações): referente ao Código de Minas;\n4\nLei nº 6.189, de 16 de dezembro de 1974\n(e alterações): referente ao escopo do licenciamento nuclear, sob competência da Comissão Nacional de Energia Nuclear – CNEN;\n5\nLei nº\n6.567, de 24 de setembro de 1978\n: referente ao regime de exploração e aproveitamento de areias, cascalhos, saibros e argilas, em área máxima de cinquenta hectares;\n6\nLei nº 6.938, de 31 de agosto de 1981\n(e alterações): art. 9º, XII; art. 17, II; Anexo VIII;\n7\nLei nº 12.305, de 2 de agosto de 2010\n: referente à Política Nacional de Resíduos Sólidos e ao Cadastro Nacional de Operadores de Resíduos Perigosos – CNORP;\n8\nDecreto nº 97.632, de 10 de abril de 1989\n: referente à exigência de plano de recuperação de área degradada para os empreendimentos de exploração de recursos minerais;\n9\nDecreto nº 9.406, de 12 de junho de 2018\n: referente à regulamentação do Código de Minas;\n10\nDecreto nº 10.935, de 12 de janeiro de 2022\n: referente à proteção das cavidades naturais subterrâneas existentes no território nacional;\n11\nResolução CONAMA nº 1, de 23 de janeiro de 1986: art. 2º, IX:\nreferente ao impacto ambiental da extração de minério, sujeita à Estudo de Impacto Ambiental e Relatório de Impacto Ambiental – EIA/RIMA;\n12\nResolução CONAMA nº 237, de 19 de dezembro de 1997:\nreferente à prevenção e ao controle de poluição da atividade Lavra subterrânea com ou sem beneficiamento, por meio de licenciamento ambiental;\n13\nResolução CONAMA nº 347, de 10 de setembro de 2004 (e alterações):\nreferente a procedimentos de monitoramento e de controle ambiental para minimizar a degradação e a destruição de cavidades naturais subterrâneas e de outros ecossistemas a elas associados;\n14\nResolução CONAMA nº 428, de 17 de dezembro de 2010 (e alterações):\nreferente à autorização de licenciamento ambiental pelos órgãos responsáveis por Unidades de Conservação;\n15\nInstrução Normativa MMA nº 2, de 20 de agosto de 2009\n: referente à classificação do grau de relevância das cavidades naturais subterrâneas;\n16\nPortaria MMA\nn\nº 55, de 17 de fevereiro de 2014\n: referente aos procedimentos entre o Instituto Chico Mendes de Conservação da Biodiversidade - Instituto Chico Mendes e o Instituto Brasileiro do Meio Ambiente e dos Recursos Naturais Renováveis - IBAMA relacionados à Resolução nº 428, de 17 de dezembro de 2010, do Conselho Nacional do Meio Ambiente – CONAMA, no âmbito do licenciamento ambiental federal;\n17\nInstrução Normativa Ibama nº 184,\nde\n17 de julho\nde 2008\n(e alterações): referente aos procedimentos para o licenciamento ambiental federal;\n18\nInstrução Normativa Ibama nº 184, de 17 de julho de 2008 (e alterações): art. 35-A: referente à obrigação de atualização, no que couber, de atividades potencialmente poluidoras e utilizadoras de recursos ambientais no CTF/APP, quando da emissão da Licença de Operação – LO;\n19\nInstrução Normativa Ibama nº 13, de 18 de dezembro de 2012\n: referente à Lista Brasileira de Resíduos Sólidos;\n20\nInstrução Normativa Ibama nº 1, de 25 de janeiro de 2013\n:\nreferente ao Cadastro Nacional de Operadores de Resíduos Perigosos – CNORP;\n21\nInstrução Normativa Ibama nº 15, de 6 de outubro de 2014\n: referente ao Sistema Nacional de Emergências Ambientais – SIEMA e às comunicações de acidentes ambientais;\n22\nInstrução Normativa Ibama nº 19, de 20 de agosto de 2018\n: referente à regulamentação do licenciamento ambiental federal do Uso e Manuseio de Radioisótopos - UMR;\n23\nInstrução Normativa Ibama nº 12, de 20 de agosto de 2021\n: referente ao Cadastro Técnico Federal de Atividades e Instrumentos de Defesa Ambiental – CTF/AIDA;\n24\nInstrução Normativa Ibama nº 13, de 23 de agosto de 2021\n: referente ao Cadastro Técnico Federal de Atividades Potencialmente Poluidoras e Utilizadoras de Recursos Ambientais – CTF/APP;\n25\nInstrução Normativa Ibama nº 22, de 22 de dezembro de 2021\n: referente ao Relatório Anual de Atividades Potencialmente Poluidoras e Utilizadoras de Recursos Ambientais – RAPP;\n26\nInstrução Normativa ICMBio nº 30, de 19 de setembro de 2012\n: referente aos procedimentos administrativos e técnicos na hipótese de empreendimento que ocasione impacto negativo irreversível em cavidades naturais subterrâneas classificada com grau de relevância alto;\n27\nInstrução Normativa ICMBio nº 7, de 5 de novembro de 2014\n: Capítulo V: referente aos procedimentos do Instituto Chico Mendes de Conservação da Biodiversidade relativos aos licenciamentos que afetem cavidades naturais subterrâneas em Unidades de Conservação Federal;\n28\nABNT NBR 12235:1992\n: Armazenamento de resíduos sólidos perigosos – Procedimento;\n29\nPortaria ANM nº 819 de 03 de dezembro de 2018\n: Estabelece instruções sobre análises oficiais de fontes de água mineral, termal, gasosa, potável de mesa ou destinada a fins balneários;\n30\nPortaria DNPM nº 237, de 18 de outubro 2001\n: (e alterações):\nreferente às Normas Reguladoras de Mineração – NRM;\n31\nPortaria DNPM n° 155, de 12 de maio de 2016\n:\nreferente à Consolidação Normativa do DNPM;\n32\nNorma CNEN NE 1.13\n: referente ao licenciamento de minas e usinas de beneficiamento de minérios de urânio e/ou tório;\n33\nNorma CNEN NN 4.01\n: referente aos requisitos de segurança e proteção radiológica para instalações mínero-industriais (NORM).\nDocumento assinado eletronicamente por\nRODRIGO ANTONIO DE AGOSTINHO MENDONÇA\n,\nPresidente\n, em 06/02/2024, às 18:09, conforme horário oficial de Brasília, com fundamento no art. 6º, § 1º, do\nDecreto nº 8.539, de 8 de outubro de 2015\n.\nA autenticidade deste documento pode ser conferida no site\nhttps://sei.ibama.gov.br/autenticidade\n, informando o código verificador\n17021438\ne o código CRC\nDB622941\n.\nReferência:\nProcesso nº 02001.001897/2018-41\nSEI nº 17021438",
      "Classificação Nacional de Atividades Econômicas": [
        {
          "agrupamento": "subclasse",
          "código": "0500-3/01",
          "descricao": "Extração de carvão mineral"
        },
        {
          "agrupamento": "subclasse",
          "código": "0710-3/01",
          "descricao": "Extração de minério de ferro"
        },
        {
          "agrupamento": "subclasse",
          "código": "0721-9/01",
          "descricao": "Extração de minério de alumínio"
        },
        {
          "agrupamento": "subclasse",
          "código": "0723-5/01",
          "descricao": "Extração de minério de manganês"
        },
        {
          "agrupamento": "subclasse",
          "código": "0724-3/01",
          "descricao": "Extração de minério de metais preciosos"
        },
        {
          "agrupamento": "subclasse",
          "código": "0725-1/00",
          "descricao": "Extração de minerais radioativos"
        },
        {
          "agrupamento": "subclasse",
          "código": "0729-4/01",
          "descricao": "Extração de minérios de nióbio e titânio"
        },
        {
          "agrupamento": "subclasse",
          "código": "0729-4/02",
          "descricao": "Extração de minério de tungstênio"
        },
        {
          "agrupamento": "subclasse",
          "código": "0729-4/03",
          "descricao": "Extração de minério de níquel"
        },
        {
          "agrupamento": "subclasse",
          "código": "0729-4/04",
          "descricao": "Extração de minérios de cobre, chumbo, zinco e outros minerais metálicos não ferrosos não especificados anteriormente"
        },
        {
          "agrupamento": "subclasse",
          "código": "0729-4/05",
          "descricao": "Beneficiamento de minérios de cobre, chumbo, zinco e outros minerais metálicos não ferrosos não especificados anteriormente"
        },
        {
          "agrupamento": "subclasse",
          "código": "0810-0/01",
          "descricao": "Extração de ardósia e beneficiamento associado"
        },
        {
          "agrupamento": "subclasse",
          "código": "0810-0/02",
          "descricao": "Extração de granito e beneficiamento associado"
        },
        {
          "agrupamento": "subclasse",
          "código": "0810-0/03",
          "descricao": "Extração de mármore e beneficiamento associado"
        },
        {
          "agrupamento": "subclasse",
          "código": "0891-6/00",
          "descricao": "Extração de minerais para fabricação de adubos, fertilizantes e outros produtos químicos"
        },
        {
          "agrupamento": "subclasse",
          "código": "0892-4/02",
          "descricao": "Extração de sal-gema"
        },
        {
          "agrupamento": "subclasse",
          "código": "0893-2/00",
          "descricao": "Extração de gemas (pedras preciosas e semipreciosas)"
        },
        {
          "agrupamento": "subclasse",
          "código": "0899-1/01",
          "descricao": "Extração de grafita"
        },
        {
          "agrupamento": "subclasse",
          "código": "0899-1/02",
          "descricao": "Extração de quartzo"
        },
        {
          "agrupamento": "subclasse",
          "código": "0899-1/99",
          "descricao": "Extração de outros minerais não metálicos não especificados anteriormente"
        },
        {
          "agrupamento": "subclasse",
          "código": "0990-4/02",
          "descricao": "Atividades de apoio à extração de minerais metálicos não ferrosos"
        },
        {
          "agrupamento": "subclasse",
          "código": "0990-4/03",
          "descricao": "Atividades de apoio à extração de minerais não metálicos"
        }
      ]
    }
  },
  {
    "url": "https://sei.ibama.gov.br/documento_consulta_externa.php?id_acesso_externo=1261131&id_documento=18738760&infra_hash=7d6638f7596d631af28ba2637d041926",
    "data": {
      "metadata": {
        "Código:": "1 – 4",
        "Versão FTE:": "1.4"
      },
      "sections": [
        {
          "title": "PP/GU:",
          "content": "Alto",
          "items": []
        },
        {
          "title": "Descritor",
          "content": "0724-3/01",
          "items": []
        },
        {
          "title": "Descritor",
          "content": "0729-4/01",
          "items": []
        },
        {
          "title": "Descritor",
          "content": "0729-4/01",
          "items": []
        },
        {
          "title": "Descritor",
          "content": "0729-4/01",
          "items": []
        },
        {
          "title": "Descritor",
          "content": "0729-4/04",
          "items": []
        },
        {
          "title": "Descritor",
          "content": "0893-2/00",
          "items": []
        },
        {
          "title": "Descritor",
          "content": "0893-2/00",
          "items": []
        },
        {
          "title": "Descritor",
          "content": "0893-2/00",
          "items": []
        },
        {
          "title": "Descritor",
          "content": "0893-2/00",
          "items": []
        },
        {
          "title": "Descritor",
          "content": "0893-2/00",
          "items": []
        },
        {
          "title": "Descritor",
          "content": "0893-2/00",
          "items": []
        },
        {
          "title": "Descritor",
          "content": "0893-2/00",
          "items": []
        },
        {
          "title": "Descritor",
          "content": "0893-2/00",
          "items": []
        },
        {
          "title": "Descritor",
          "content": "0893-2/00",
          "items": []
        },
        {
          "title": "Descritor",
          "content": "0893-2/00",
          "items": []
        },
        {
          "title": "Descritor",
          "content": "0893-2/00",
          "items": []
        },
        {
          "title": "Descritor",
          "content": "0893-2/00",
          "items": []
        },
        {
          "title": "Descritor",
          "content": "0893-2/00",
          "items": []
        },
        {
          "title": "Descritor",
          "content": "0893-2/00",
          "items": []
        },
        {
          "title": "Descritor",
          "content": "0893-2/00",
          "items": []
        },
        {
          "title": "Descritor",
          "content": "0893-2/00",
          "items": []
        },
        {
          "title": "Descritor",
          "content": "0893-2/00",
          "items": []
        },
        {
          "title": "Descritor",
          "content": "0899-1/99",
          "items": []
        },
        {
          "title": "Descritor",
          "content": "0899-1/99",
          "items": []
        },
        {
          "title": "Descritor",
          "content": "0899-1/99",
          "items": []
        },
        {
          "title": "Subclasse",
          "content": "0722-7/01",
          "items": []
        },
        {
          "title": "Subclasse",
          "content": "0729-4/02",
          "items": []
        },
        {
          "title": "Subclasse",
          "content": "0899-1/02",
          "items": []
        },
        {
          "title": "CTF/APP:",
          "content": "consulte a relação deFichas Técnicas de Enquadramento.",
          "items": []
        },
        {
          "title": "CNORP:",
          "content": "sim.",
          "items": []
        },
        {
          "title": "CTF/AIDA:",
          "content": "sim.",
          "items": []
        },
        {
          "title": "RAPP:",
          "content": "sim.",
          "items": []
        },
        {
          "title": "1",
          "content": "Decreto-Lei nº 227, de 28 de fevereiro de 1967(e alterações): referente ao Código de Minas;",
          "items": []
        },
        {
          "title": "2",
          "content": "Lei nº 6.938, de 31 de agosto de 1981(e alterações): art. 9º, XII; art. 17, II; Anexo VIII;",
          "items": []
        },
        {
          "title": "3",
          "content": "Lei nº 7.805, de 18 de julho de 1989: referente ao regime de permissão de lavra garimpeira;",
          "items": []
        },
        {
          "title": "4",
          "content": "Lei nº 11.685,de 2 de junho de2008: referente ao Estatuto do Garimpeiro e à obrigação de reparação de áreas degradadas por suas atividades;",
          "items": []
        },
        {
          "title": "5",
          "content": "Lei nº 12.305, de 2 de agosto de 2010: referente à Política Nacional de Resíduos Sólidos e ao Cadastro Nacional de Operadores de Resíduos Perigosos – CNORP;",
          "items": []
        },
        {
          "title": "6",
          "content": "Decreto nº 97.632, de 10 de abril de 1989: referente à exigência de plano de recuperação de área degradada para os empreendimentos de exploração de recursos minerais;",
          "items": []
        },
        {
          "title": "7",
          "content": "Decreto nº 9.406, de 12 de junho de 2018: referente à regulamentação da lavra garimpeira;",
          "items": []
        },
        {
          "title": "8",
          "content": "Resolução CONAMA nº 1, de 23 de janeiro de 1986: art. 2º, IX:referente ao impacto ambiental da extração de minério, sujeita à Estudo de Impacto Ambiental e Relatório de Impacto Ambiental – EIA/RIMA;",
          "items": []
        },
        {
          "title": "9",
          "content": "Resolução CONAMA nº 237, de 19 de dezembro de 1997:referente à prevenção e ao controle de poluição da atividade Lavra garimpeira, por meio de licenciamento ambiental;",
          "items": []
        },
        {
          "title": "10",
          "content": "Resolução CONAMA nº 428, de 17 de dezembro de 2010 (e alterações):referente à autorização de licenciamento ambiental pelos órgãos responsáveis por Unidades de Conservação;",
          "items": []
        },
        {
          "title": "11",
          "content": "Portaria MMAnº 55, de 17 de fevereiro de 2014: referente aos procedimentos entre o Instituto Chico Mendes de Conservação da Biodiversidade - Instituto Chico Mendes e o Instituto Brasileiro do Meio Ambiente e dos Recursos Naturais Renováveis - IBAMA relacionados à Resolução nº 428, de 17 de dezembro de 2010, do Conselho Nacional do Meio Ambiente – CONAMA, no âmbito do licenciamento ambiental federal;",
          "items": []
        },
        {
          "title": "12",
          "content": "Instrução Normativa Ibama nº 184,de17 de julhode 2008(e alterações): referente aos procedimentos para o licenciamento ambiental federal;",
          "items": []
        },
        {
          "title": "13",
          "content": "Instrução Normativa Ibama nº 184, de 17 de julho de 2008 (e alterações): art. 35-A: referente à obrigação de atualização, no que couber, de atividades potencialmente poluidoras e utilizadoras de recursos ambientais no CTF/APP, quando da emissão da Licença de Operação – LO;",
          "items": []
        },
        {
          "title": "14",
          "content": "Instrução Normativa Ibama nº 13, de 18 de dezembro de 2012: referente à Lista Brasileira de Resíduos Sólidos;",
          "items": []
        },
        {
          "title": "15",
          "content": "Instrução Normativa Ibama nº 1, de 25 de janeiro de 2013: referente ao Cadastro Nacional de Operadores de Resíduos Perigosos – CNORP;",
          "items": []
        },
        {
          "title": "16",
          "content": "Instrução Normativa Ibama nº 12, de 20 de agosto de 2021: referente ao Cadastro Técnico Federal de Atividades e Instrumentos de Defesa Ambiental – CTF/AIDA;",
          "items": []
        },
        {
          "title": "17",
          "content": "Instrução Normativa Ibama nº 13, de 23 de agosto de 2021: referente ao Cadastro Técnico Federal de Atividades Potencialmente Poluidoras e Utilizadoras de Recursos Ambientais – CTF/APP;",
          "items": []
        },
        {
          "title": "18",
          "content": "Instrução Normativa Ibama nº 22, de 22 de dezembro de 2021: referente ao Relatório Anual de Atividades Potencialmente Poluidoras e Utilizadoras de Recursos Ambientais – RAPP;",
          "items": []
        },
        {
          "title": "19",
          "content": "Instrução Normativa ICMBio nº 7, de 5 de novembro de 2014: referente aos procedimentos do Instituto Chico Mendes de Conservação da Biodiversidade nos processos de licenciamento ambiental;",
          "items": []
        },
        {
          "title": "20",
          "content": "ABNT NBR 12235:1992: Armazenamento de resíduos sólidos perigosos – Procedimento;",
          "items": []
        },
        {
          "title": "21",
          "content": "Portaria DNPM nº 155, de 12 de maio de 2016:referente à Consolidação Normativa do DNPM.",
          "items": []
        }
      ],
      "raw_content": "SEI/IBAMA - 17021453 - Ficha Técnica de Enquadramento\nMinistério do Meio Ambiente\nInstituto Brasileiro do Meio Ambiente e dos Recursos Naturais Renováveis\nCadastro Técnico Federal de Atividades Potencialmente Poluidoras e Utilizadoras de Recursos Ambientais – CTF/APP\nFICHA TÉCNICA DE ENQUADRAMENTO\nCódigo:\n1 – 4\nDescrição:\nLavra garimpeira\nVersão FTE:\n1.4\nData:\n29/01/2024\nPP/GU:\nAlto\nTipo de pessoa:\nPessoa jurídica:\nSim\n(1)\nPessoa física:\nSim\n(1)\nA descrição compreende:\n- a garimpagem do ouro, do diamante, da cassiterita, da columbita, da tantalita e wolframita, nas formas aluvionar, eluvionar e coluvial, da sheelita, das demais gemas, do rutilo, do quartzo, do berilo, da muscovita, do espodumênio, da lepidolita, do feldspato e da mica;\n- a extração de minerais sob o regime de permissão lavra garimpeira;\n- a garimpagem do ouro sem a utilização de mercúrio metálico;\n- a garimpagem de outros tipos de minerais garimpáveis;\n- a garimpagem com a utilização de draga.\nÉ obrigada à inscrição no\nCadastro Técnico Federal de Atividades Potencialmente Poluidoras e Utilizadoras de Recursos Ambientais\n,\ndeclarando a atividade cód. 1 – 4, a pessoa física ou jurídica que exerça atividade, em caráter permanente ou eventual, ou constitua empreendimento, conforme descrições no campo acima.\nA descrição não\ncompreende:\n(Para descrições com código em parênteses, consulte as respectivas FTE.)\n- a garimpagem do ouro com a utilização de mercúrio metálico (1 – 7);\n- a garimpagem do ouro com a utilização de draga e mercúrio metálico (1 – 7);\n- a dragagem e derrocamentos em corpos d'água (17 – 5);\n- a disposição final de rejeitos da indústria ou da mineração em confinamento licenciado pelo órgão ambiental competente (17 – 58);\n- o tratamento de resíduos de mineração (17 – 59);\n- a recuperação de áreas degradadas (17 – 67);\n- a recuperação de áreas contaminadas (17 – 68);\n- o transporte de combustível em empreendimento minerário por meio de caminhão-tanque (18 – 1);\n- o Posto de Abastecimento – PA (18 – 5);\n- a construção de barragens e diques (22 – 2);\n- a construção de canais para drenagem (22 – 3);\n- a retificação de curso de água (22 – 4);\n- a transposição de bacias hidrográficas (22 – 6);\n- a construção de obras de arte (22 – 7);\n- outras obras de infraestrutura (22 – 8).\nNão é obrigada à inscrição no\nCadastro Técnico Federal de Atividades Potencialmente Poluidoras e Utilizadoras de Recursos Ambientais\n,\nem razão da atividade cód. 1 – 4, a pessoa física ou jurídica que exerça atividade ou constitua empreendimento, conforme descrições no campo acima.\nDefinições e linhas de corte:\n-\ndraga:\nembarcação própria para retirar depósitos do fundo do mar ou de rios, em portos ou canais, a fim de aumentar a profundidade nesses locais;\n-\ngarimpagem:\natividade de aproveitamento de substâncias minerais garimpáveis, inclusive as atividades de beneficiamento associadas ou em continuação à extração dessas substâncias, executadas no interior de áreas estabelecidas para este fim (áreas de garimpagem), exercida por brasileiro, cooperativa de garimpeiros, autorizada a funcionar como empresa de mineração, sob o regime de permissão de lavra garimpeira;\n-\nlavra garimpeira:\no\naproveitamento imediato de substância mineral garimpável, compreendido o material inconsolidado, exclusivamente nas formas aluvionar, eluvionar e coluvial, que, por sua natureza, seu limite espacial, sua localização e sua utilização econômica, possa ser lavrado, independentemente de trabalhos prévios de pesquisa, segundo os critérios estabelecidos pela Agência Nacional de Mineração;\n-\nmineral garimpável:\no\nouro, o diamante, a cassiterita, a columbita, a tantalita e wolframita, nas formas aluvionar, eluvionar e coluvial; a sheelita, as demais gemas, o rutilo, o quartzo, o berilo, a muscovita, o espodumênio, a lepidolita, o feldspato, a mica e outros, em tipos de ocorrência que vierem a ser indicados, a critério da Agência Nacional de Mineração.\n- regime de autorização\n: destinado às atividades de pesquisa mineral, outorgada por ato da Agência Nacional de Mineração;\n- regime de concessão\n: destinado às atividades de lavra mineral precedidas de pesquisa, outorgada por ato do Ministro de Estado de Minas e Energia, ou da Agência Nacional de Mineração, na hipótese de a concessão ter por objeto as substâncias minerais de que trata o art. 1º da Lei nº 6.567, de 1978;\n- regime de lavra garimpeira\n: destinado à atividade de lavra mineral prevista na Lei nº 7.805, de 1989, outorgada por título expedido pela Agência Nacional de Mineração;\n- regime de licenciamento\n: destinado às atividades de lavra das substâncias minerais de que trata o art. 1º da Lei nº 6.567, de 1978, outorgado por licença expedida em conformidade com regulamentos administrativos locais e por registro da licença na Agência Nacional de Mineração;\n- regime de monopolização\n: quando, em decorrência de lei especial, o aproveitamento de recursos minerais depender de execução direta ou indireta do Poder Executivo federal.\nClassificação Nacional de Atividades Econômicas\n–\nCNAE:\nAgrupamento:\nCódigo:\nDescrição:\nDescritor\n0724-3/01\nOURO DE ALUVIÃO OU EM PÓ; EXTRAÇÃO DE\nDescritor\n0729-4/01\nMINÉRIO DE COLÔMBIO OU NIÓBIO - TÂNTALO (COLOMBITA - TANTALITA); EXTRAÇÃO DE\nDescritor\n0729-4/01\nMINÉRIO DE NIÓBIO; EXTRAÇÃO DE\nDescritor\n0729-4/01\nMINÉRIO DE TITÂNIO (ILMENITA E RUTILO); EXTRAÇÃO DE\nDescritor\n0729-4/04\nMINÉRIO DE LÍTIO (AMBLIGONITA, LEPIDOLITA, PEDALITA); EXTRAÇÃO DE\nDescritor\n0893-2/00\nGEMAS E DIAMANTES (PEDRA PRECIOSA); EXTRAÇÃO DE\nDescritor\n0893-2/00\nBERILO (PEDRA SEMIPRECIOSA); EXTRAÇÃO DE\nDescritor\n0893-2/00\nESMERALDA (PEDRA PRECIOSA); EXTRAÇÃO DE\nDescritor\n0893-2/00\nAMETISTA (PEDRA SEMIPRECIOSA); EXTRAÇÃO DE\nDescritor\n0893-2/00\nCORÍNDON (PEDRA PRECIOSA); EXTRAÇÃO DE\nDescritor\n0893-2/00\nGEMAS; EXTRAÇÃO DE\nDescritor\n0893-2/00\nGRANADA (PEDRA SEMIPRECIOSA); EXTRAÇÃO DE\nDescritor\n0893-2/00\nOPALA (PEDRA PRECIOSA); EXTRAÇÃO DE\nDescritor\n0893-2/00\nPEDRAS PRECIOSAS; EXTRAÇÃO DE\nDescritor\n0893-2/00\nPEDRAS SEMIPRECIOSAS; EXTRAÇÃO DE\nDescritor\n0893-2/00\nRUBI (PEDRA PRECIOSA); EXTRAÇÃO DE\nDescritor\n0893-2/00\nSAFIRA (PEDRA PRECIOSA); EXTRAÇÃO DE\nDescritor\n0893-2/00\nTOPÁZIO (PEDRA SEMIPRECIOSA); EXTRAÇÃO DE\nDescritor\n0893-2/00\nTURMALINA (PEDRA SEMIPRECIOSA); EXTRAÇÃO DE\nDescritor\n0893-2/00\nÁGATA (PEDRA SEMIPRECIOSA); EXTRAÇÃO DE\nDescritor\n0893-2/00\nÁGUA-MARINHA (PEDRA SEMIPRECIOSA); EXTRAÇÃO DE\nDescritor\n0893-2/00\nÔNIX (PEDRA SEMIPRECIOSA); EXTRAÇÃO DE\nDescritor\n0899-1/99\nFELDSPATO, LEUCITA OU NEFELITA NATURAIS; BENEFICIAMENTO DE (ASSOCIADO A EXTRAÇÃO)\nDescritor\n0899-1/99\nMICA OU MALACACHETA; BENEFICIAMENTO DE (ASSOCIADO A EXTRAÇÃO)\nDescritor\n0899-1/99\nMICA OU MALACACHETA; EXTRAÇÃO DE\nSubclasse\n0722-7/01\nExtração de minério de estanho\nSubclasse\n0729-4/02\nExtração de minério de tungstênio\nSubclasse\n0899-1/02\nExtração de quartzo\nA obrigação de inscrição, no Cadastro Técnico Federal de Atividades Potencialmente Poluidoras e Utilizadoras de Recursos Ambientais, não se vincula à Classificação Nacional de Atividades Econômicas, que pode ser utilizada como referência de enquadramento.\nOutras atividades do Cadastro Técnico Federal de Atividades Potencialmente Poluidoras e Utilizadoras de Recursos Ambientais\n, Cadastros do Ibama e Relatório Anual de Atividades:\nCTF/APP:\nconsulte a relação de\nFichas Técnicas de Enquadramento\n.\nCNORP:\nsim.\nCTF/AIDA:\nsim.\nRAPP:\nsim.\nA declaração de atividades, no Cadastro Técnico Federal de Atividades Potencialmente Poluidoras e Utilizadoras de Recursos Ambientais, que sejam constantes do objeto social da empresa ou da inscrição no Cadastro Nacional da Pessoa Jurídica (CNPJ) não desobriga a pessoa jurídica de declarar outras atividades potencialmente poluidoras e utilizadoras de recursos ambientais que sejam exercidas pela empresa.\nObservações:\n(1)\nÉ obrigada à inscrição\nno Cadastro Técnico Federal de Atividades Potencialmente Poluidoras e Utilizadoras de Recursos Ambientais, a pessoa titular da permissão da lavra garimpeira, seja pessoa física, seja pessoa jurídica, inclusive as cooperativas minerárias.\nReferências normativas:\n1\nDecreto-Lei nº 227, de 28 de fevereiro de 1967\n(e alterações): referente ao Código de Minas;\n2\nLei nº 6.938, de 31 de agosto de 1981\n(e alterações): art. 9º, XII; art. 17, II; Anexo VIII;\n3\nLei nº 7.805, de 18 de julho de 1989\n: referente ao regime de permissão de lavra garimpeira;\n4\nLei nº 11.685,\nde 2 de junho de\n2008\n: referente ao Estatuto do Garimpeiro e à obrigação de reparação de áreas degradadas por suas atividades;\n5\nLei nº 12.305, de 2 de agosto de 2010\n: referente à Política Nacional de Resíduos Sólidos e ao Cadastro Nacional de Operadores de Resíduos Perigosos – CNORP;\n6\nDecreto nº 97.632, de 10 de abril de 1989\n: referente à exigência de plano de recuperação de área degradada para os empreendimentos de exploração de recursos minerais;\n7\nDecreto nº 9.406, de 12 de junho de 2018\n: referente à regulamentação da lavra garimpeira;\n8\nResolução CONAMA nº 1, de 23 de janeiro de 1986: art. 2º, IX:\nreferente ao impacto ambiental da extração de minério, sujeita à Estudo de Impacto Ambiental e Relatório de Impacto Ambiental – EIA/RIMA;\n9\nResolução CONAMA nº 237, de 19 de dezembro de 1997:\nreferente à prevenção e ao controle de poluição da atividade Lavra garimpeira, por meio de licenciamento ambiental;\n10\nResolução CONAMA nº 428, de 17 de dezembro de 2010 (e alterações):\nreferente à autorização de licenciamento ambiental pelos órgãos responsáveis por Unidades de Conservação;\n11\nPortaria MMA\nn\nº 55, de 17 de fevereiro de 2014\n: referente aos procedimentos entre o Instituto Chico Mendes de Conservação da Biodiversidade - Instituto Chico Mendes e o Instituto Brasileiro do Meio Ambiente e dos Recursos Naturais Renováveis - IBAMA relacionados à Resolução nº 428, de 17 de dezembro de 2010, do Conselho Nacional do Meio Ambiente – CONAMA, no âmbito do licenciamento ambiental federal;\n12\nInstrução Normativa Ibama nº 184,\nde\n17 de julho\nde 2008\n(e alterações): referente aos procedimentos para o licenciamento ambiental federal;\n13\nInstrução Normativa Ibama nº 184, de 17 de julho de 2008 (e alterações): art. 35-A: referente à obrigação de atualização, no que couber, de atividades potencialmente poluidoras e utilizadoras de recursos ambientais no CTF/APP, quando da emissão da Licença de Operação – LO;\n14\nInstrução Normativa Ibama nº 13, de 18 de dezembro de 2012\n: referente à Lista Brasileira de Resíduos Sólidos;\n15\nInstrução Normativa Ibama nº 1, de 25 de janeiro de 2013\n: referente ao Cadastro Nacional de Operadores de Resíduos Perigosos – CNORP;\n16\nInstrução Normativa Ibama nº 12, de 20 de agosto de 2021\n: referente ao Cadastro Técnico Federal de Atividades e Instrumentos de Defesa Ambiental – CTF/AIDA;\n17\nInstrução Normativa Ibama nº 13, de 23 de agosto de 2021\n: referente ao Cadastro Técnico Federal de Atividades Potencialmente Poluidoras e Utilizadoras de Recursos Ambientais – CTF/APP;\n18\nInstrução Normativa Ibama nº 22, de 22 de dezembro de 2021\n: referente ao Relatório Anual de Atividades Potencialmente Poluidoras e Utilizadoras de Recursos Ambientais – RAPP;\n19\nInstrução Normativa ICMBio nº 7, de 5 de novembro de 2014\n: referente aos procedimentos do Instituto Chico Mendes de Conservação da Biodiversidade nos processos de licenciamento ambiental;\n20\nABNT NBR 12235:1992\n: Armazenamento de resíduos sólidos perigosos – Procedimento;\n21\nPortaria DNPM nº 155, de 12 de maio de 2016\n:\nreferente à Consolidação Normativa do DNPM.\nDocumento assinado eletronicamente por\nRODRIGO ANTONIO DE AGOSTINHO MENDONÇA\n,\nPresidente\n, em 06/02/2024, às 18:09, conforme horário oficial de Brasília, com fundamento no art. 6º, § 1º, do\nDecreto nº 8.539, de 8 de outubro de 2015\n.\nA autenticidade deste documento pode ser conferida no site\nhttps://sei.ibama.gov.br/autenticidade\n, informando o código verificador\n17021453\ne o código CRC\n6936E92A\n.\nReferência:\nProcesso nº 02001.001905/2018-50\nSEI nº 17021453",
      "Classificação Nacional de Atividades Econômicas": [
        {
          "agrupamento": "descritor",
          "código": "0724-3/01",
          "descricao": "OURO DE ALUVIÃO OU EM PÓ; EXTRAÇÃO DE"
        },
        {
          "agrupamento": "descritor",
          "código": "0729-4/01",
          "descricao": "MINÉRIO DE COLÔMBIO OU NIÓBIO - TÂNTALO (COLOMBITA - TANTALITA); EXTRAÇÃO DE"
        },
        {
          "agrupamento": "descritor",
          "código": "0729-4/01",
          "descricao": "MINÉRIO DE COLÔMBIO OU NIÓBIO - TÂNTALO (COLOMBITA - TANTALITA); EXTRAÇÃO DE"
        },
        {
          "agrupamento": "descritor",
          "código": "0729-4/01",
          "descricao": "MINÉRIO DE COLÔMBIO OU NIÓBIO - TÂNTALO (COLOMBITA - TANTALITA); EXTRAÇÃO DE"
        },
        {
          "agrupamento": "descritor",
          "código": "0729-4/04",
          "descricao": "MINÉRIO DE LÍTIO (AMBLIGONITA, LEPIDOLITA, PEDALITA); EXTRAÇÃO DE"
        },
        {
          "agrupamento": "descritor",
          "código": "0893-2/00",
          "descricao": "GEMAS E DIAMANTES (PEDRA PRECIOSA); EXTRAÇÃO DE"
        },
        {
          "agrupamento": "descritor",
          "código": "0893-2/00",
          "descricao": "GEMAS E DIAMANTES (PEDRA PRECIOSA); EXTRAÇÃO DE"
        },
        {
          "agrupamento": "descritor",
          "código": "0893-2/00",
          "descricao": "GEMAS E DIAMANTES (PEDRA PRECIOSA); EXTRAÇÃO DE"
        },
        {
          "agrupamento": "descritor",
          "código": "0893-2/00",
          "descricao": "GEMAS E DIAMANTES (PEDRA PRECIOSA); EXTRAÇÃO DE"
        },
        {
          "agrupamento": "descritor",
          "código": "0893-2/00",
          "descricao": "GEMAS E DIAMANTES (PEDRA PRECIOSA); EXTRAÇÃO DE"
        },
        {
          "agrupamento": "descritor",
          "código": "0893-2/00",
          "descricao": "GEMAS E DIAMANTES (PEDRA PRECIOSA); EXTRAÇÃO DE"
        },
        {
          "agrupamento": "descritor",
          "código": "0893-2/00",
          "descricao": "GEMAS E DIAMANTES (PEDRA PRECIOSA); EXTRAÇÃO DE"
        },
        {
          "agrupamento": "descritor",
          "código": "0893-2/00",
          "descricao": "GEMAS E DIAMANTES (PEDRA PRECIOSA); EXTRAÇÃO DE"
        },
        {
          "agrupamento": "descritor",
          "código": "0893-2/00",
          "descricao": "GEMAS E DIAMANTES (PEDRA PRECIOSA); EXTRAÇÃO DE"
        },
        {
          "agrupamento": "descritor",
          "código": "0893-2/00",
          "descricao": "GEMAS E DIAMANTES (PEDRA PRECIOSA); EXTRAÇÃO DE"
        },
        {
          "agrupamento": "descritor",
          "código": "0893-2/00",
          "descricao": "GEMAS E DIAMANTES (PEDRA PRECIOSA); EXTRAÇÃO DE"
        },
        {
          "agrupamento": "descritor",
          "código": "0893-2/00",
          "descricao": "GEMAS E DIAMANTES (PEDRA PRECIOSA); EXTRAÇÃO DE"
        },
        {
          "agrupamento": "descritor",
          "código": "0893-2/00",
          "descricao": "GEMAS E DIAMANTES (PEDRA PRECIOSA); EXTRAÇÃO DE"
        },
        {
          "agrupamento": "descritor",
          "código": "0893-2/00",
          "descricao": "GEMAS E DIAMANTES (PEDRA PRECIOSA); EXTRAÇÃO DE"
        },
        {
          "agrupamento": "descritor",
          "código": "0893-2/00",
          "descricao": "GEMAS E DIAMANTES (PEDRA PRECIOSA); EXTRAÇÃO DE"
        },
        {
          "agrupamento": "descritor",
          "código": "0893-2/00",
          "descricao": "GEMAS E DIAMANTES (PEDRA PRECIOSA); EXTRAÇÃO DE"
        },
        {
          "agrupamento": "descritor",
          "código": "0893-2/00",
          "descricao": "GEMAS E DIAMANTES (PEDRA PRECIOSA); EXTRAÇÃO DE"
        },
        {
          "agrupamento": "descritor",
          "código": "0899-1/99",
          "descricao": "FELDSPATO, LEUCITA OU NEFELITA NATURAIS; BENEFICIAMENTO DE (ASSOCIADO A EXTRAÇÃO)"
        },
        {
          "agrupamento": "descritor",
          "código": "0899-1/99",
          "descricao": "FELDSPATO, LEUCITA OU NEFELITA NATURAIS; BENEFICIAMENTO DE (ASSOCIADO A EXTRAÇÃO)"
        },
        {
          "agrupamento": "descritor",
          "código": "0899-1/99",
          "descricao": "FELDSPATO, LEUCITA OU NEFELITA NATURAIS; BENEFICIAMENTO DE (ASSOCIADO A EXTRAÇÃO)"
        },
        {
          "agrupamento": "subclasse",
          "código": "0722-7/01",
          "descricao": "Extração de minério de estanho"
        },
        {
          "agrupamento": "subclasse",
          "código": "0729-4/02",
          "descricao": "Extração de minério de tungstênio"
        },
        {
          "agrupamento": "subclasse",
          "código": "0899-1/02",
          "descricao": "Extração de quartzo"
        }
      ]
    }
  }
]